article,date
Apple Inc. (AAPL): A Beginner Stock You Should Check Out,2024-08-29
Apple Is Citis Top AI Stock Pick. Its Finally Beating the Market.,2024-08-29
Apple Stock Can Taste A Breakout As Tesla Falls Farther From The Tree,2024-08-29
Breakout Watch: Apple Stock Shines As Tesla Falls Farther From The Tree,2024-08-29
Is Meta Stock A Buy As It Hovers Near Key Level?,2024-08-29
Apple invents Nose Tracking Sensors for Future Vision-centric Headsets that are designed to keep the lenses in proper alignment at all times,2024-08-29
Q4 2024 Affirm Holdings Inc Earnings Call,2024-08-29
Apple Option Trade Could Return 22% In 7 Weeks,2024-08-29
Will Nvidia Be Worth More Than Apple by 2030?,2024-08-29
"Jim Cramer on Apple Inc. (AAPL): Own It, Dont Trade It",2024-08-29
Was Warren Buffett's Big Sale of Apple Stock a Bet on Kamala Harris Beating Donald Trump?,2024-08-29
Huawei Revenue Jumps After Eating Apples Market Share in China,2024-08-29
"The Best Warren Buffett Stocks to Buy With $50,000 Right Now",2024-08-29
Indias iPhone hopes and South Koreas EV concerns,2024-08-29
Apple's new iOS developer beta lets you remove objects from pictures using AI,2024-08-29
Apple becomes India's largest blue-collar job creator,2024-08-28
Apple pushing enhanced optical zoom for iPhones to stay competitive,2024-08-28
"Salesforce CEO on robot sales agents, Microsoft's AI letdowns, and big earnings beat",2024-08-28
Apple introduces AI-powered object removal in photos with the latest iOS update,2024-08-28
One Tech Tip: How to get the most life out of your device,2024-08-28
Prediction: This Under-the-Radar Tech Stock Will Outperform Nvidia and Apple by 2030,2024-08-28
Berkshire Hathaway cut Apple stake to have 'margin of safety',2024-08-28
Is Apple Siri the Best AI Assistant in 2024?,2024-08-28
Google revamps controversial AI image generation tool after backlash,2024-08-28
Magnificent Seven Stocks: Nvidia Stock Slides Ahead Of Earnings; Tesla Extends Losses,2024-08-28
Should you rush to buy the new iPhone 16 or can you wait?,2024-08-28
Big Tech Is Under Pressure Today. But So Is the Dow,2024-08-28
Warren Buffett's Berkshire Hathaway Enters $1 Trillion Club,2024-08-28
Nvidia Stock Weighs on Tech Sector Ahead of Earnings,2024-08-28
"Top Stock Movers Now: Super Micro Computer, JM Smucker, Nvidia, and More",2024-08-28
Apple to cut 100 jobs in fourth round of 2024 layoffs: BBG,2024-08-28
"Retail Reports, a Rundown on the State of the Podcast Industry, and 2 Stocks Worth Watching",2024-08-28
Warren Buffett's Berkshire joins the $1 trillion club,2024-08-28
"Apple to Cut Jobs in Services Unit, Report Says. Whats Behind the Move.",2024-08-28
Warren Buffett Isnt Alone  Some Other Top Billionaires are Also Dumping Apple (AAPL),2024-08-28
Prediction: Vanguard's 3 Best-Performing ETFs Over the Last 5 Years Will Also Beat the S&P 500 Over the Next 5 Years,2024-08-28
3 Warren Buffett Stocks to Hold Forever,2024-08-28
"Apple's Market Share Poised To Gain, GenAI And iPhone 16 Lead the Way: IDC",2024-08-28
Apple just took a bite out of the teams behind its Books and News apps,2024-08-28
Heres Why Billionaire Dan Loeb Could Be Wrong About Apple Inc. (NASDAQ:AAPL),2024-08-28
These Are Warren Buffett's Favorite Artificial Intelligence (AI) Stocks,2024-08-28
Warren Buffett Once Had $189 Billion Invested in 4 Artificial Intelligence (AI) Stocks. He's Now Slashed This Stake by Roughly 50%!,2024-08-28
"Warren Buffett Has More Money Invested in This Than He Does Apple, AmEx, Bank of America, Coke, Chevron, and Oxy Combined",2024-08-28
Apple Cuts Jobs in Online Services Group as Priorities Shift,2024-08-27
"Apple maintains MacBook shipments at 15M units amid Foxconn, Quanta, and Wingtech order cuts",2024-08-27
"Apple unlikely to move capacity back to China, say sources",2024-08-27
"Apple's CFO transition seems relatively seamless, says Jim Cramer",2024-08-27
"Apple's CFO has been the 'steward of Apple's massive cash hoard', says Jim Cramer",2024-08-27
Apple stock analysts chime in after C-suite shakeup,2024-08-27
Analysts are Recommending These 10 AI Stocks,2024-08-27
"Luca Maestri to Step Down as Apple CFO, The CFO Position at Apple, Apple Succession Planning",2024-08-27
Can Big Tech Solve Housing Affordability?,2024-08-27
Apple Stock Rises On Fall Product Launch Event Anticipation,2024-08-27
Apple Inc. (AAPL): Among Morgan Stanleys Highest Conviction Stocks,2024-08-27
Should You Buy Apple Stock Before Sept. 9? Here's What the Evidence Suggests,2024-08-27
Apple's Got a New CFOWhat Investors Need to Know About the Change,2024-08-27
IDC raises annual global smartphone shipments forecast on GenAI optimism,2024-08-27
The ABC's of Alternative Investing,2024-08-27
Apples CFO Change Looks Smooth. Who Comes After Tim Cook Is More of a Problem.,2024-08-27
Apple Names New CFO. The Stock Is Up.,2024-08-27
Apple Inc. (AAPL): Trending AI Stock on Latest Analyst Ratings and News,2024-08-27
"Apple CFO transition will be 'seamless,' says Wedbush's Dan Ives",2024-08-27
Why Apple's iPhone 16 might not be enough to drive sales,2024-08-27
"Apple's 3rd Co-Founder Sold His 10% Stake For Only $800  Today It Would Be Worth $345 Billion, But He Says Stress Wasn't Worth It",2024-08-27
"Microsoft 2Q24 Earnings, Ranking Big Tech's 2Q24 Performance",2024-08-27
Apple's High Valuation: A Bull Trap in the Making?,2024-08-27
Here are some of the challenges Apple's next CFO will face,2024-08-27
Affirm Earnings Are Soon. Its Apple BNPL Deal Will Be in Focus.,2024-08-27
Apple CFO Luca Maestri to transition into new role in 2025,2024-08-27
Billionaire Daniel Loeb Added To These Three Stocks: Should You Join Him?,2024-08-27
Apple Inc. (AAPL) Is a Trending Stock: Facts to Know Before Betting on It,2024-08-27
Apple CFO Luca Maestri to step down on January 1: Here's what to know,2024-08-27
5 Things to Know Before the Stock Market Opens,2024-08-27
Apple Is a Big Risk as Mag 7 Stocks Look Vulnerable. Heres Why and 5 Other Things to Know Today.,2024-08-27
Apple's Luca Maestri to step down as CFO; analysts share their views,2024-08-27
Prediction: 3 Artificial Intelligence (AI) Stocks That Will Be Worth More Than Nvidia in 3 Years,2024-08-27
Affirm Earnings Are Coming. Its Apple BNPL Deal Will Be in Focus.,2024-08-27
Apples iPhone Event Announced. Its a Big Deal for the Market's Big AI Bets.,2024-08-27
AI Integration Lifted Apple (AAPL) in Q2,2024-08-27
Watch These Apple Stock Price Levels Ahead of Expected iPhone 16 Launch,2024-08-26
Australias Zip In Talks With Apple For U.S. Buy-Now-Pay-Later Integration,2024-08-26
29% of Warren Buffett's Portfolio Is Invested in This 1 Monster AI Stock,2024-08-26
Apple CFO stepping down,2024-08-26
Apple Names Kevan Parekh Its Next CFO,2024-08-26
Apples Top Finance Executive to Step Down,2024-08-26
Apple AI more compelling for stock than iPhone 16: Analyst,2024-08-26
Apple CFO transition: Luca Maestri to be replaced by Kevan Parekh,2024-08-26
Apples iPhone Event Is Coming. Its a Big Deal This Time.,2024-08-26
Apple announces Chief Financial Officer transition,2024-08-26
Apple Expected To Unveil iPhone 16 on Sept. 9 What You Need to Know,2024-08-26
"Apple announces its September event, new iPhone expected",2024-08-26
Apple is expected to debut the first generative AI iPhone at its September 9 event,2024-08-26
"Apple Sends Invites for Sept. 9 Event, New iPhone and AI-Features Expected",2024-08-26
Apple Plans Sept. 9 Event; New iPhone and AI Features Expected,2024-08-26
15 Trending AI Stocks on Latest Analyst Ratings and News,2024-08-26
Apple Inc. (AAPL): A Good Technology Stock To Buy For Long Term,2024-08-26
Apple to Hold Glowtime iPhone 16 Launch Event on Sept. 9,2024-08-26
"Apple to hold fall event on Sept. 9, new iPhones expected",2024-08-26
"Apple, Tesla Bases Show Why Stock Market Corrections Are Needed",2024-08-26
Apple Inc. (AAPL): Among The Best American Stocks To Buy For Foreign Investors,2024-08-26
AI uses a lot of energy. How Big Tech is trying to fix it,2024-08-25
Nvidia gets ready to take over the stock market (again),2024-08-25
Warren Buffett Just Made His Biggest Stock Sale Ever. Here's What the Tax Bill Could Be.,2024-08-25
3 Reasons to Buy Apple Stock Like There's No Tomorrow,2024-08-25
"Street calls of the week: Upgrades for Crocs, Roku, BrightView Holdings",2024-08-25
5 big analyst AI moves: Buy Nvidia stock ahead of earnings; BIDU downgraded,2024-08-25
Here's Why Wall Street is Excited About Apple's (AAPL) Upcoming New iPhone Event in September,2024-08-24
Will Alphabet (GOOG) AI Phones Crush Apple's AI Plans?,2024-08-24
"Up 69% in 2024, This Red-Hot Artificial Intelligence (AI) Growth Stock Could Keep Soaring",2024-08-24
"Apple invents a new Vision-Family HMD that provides a built-in Projector, removable Controller & more + Apple files for new Shazam TM",2024-08-24
"Meet the Supercharged Growth Stock That Could Join Apple, Microsoft, and Nvidia in the $3 Trillion Club by 2031",2024-08-24
Microsoft continues their work on Copying Apple Vision's EyeSight feature while revealing Smart Ring & Bracelet devices in-the-works,2024-08-24
"If You Bought 1 Share of Apple at Its IPO, Here's How Many Shares You Would Own Now",2024-08-24
"Jeff Bezos' new jet, Monterey Car Week, and Labor Day travel: Lifestyle news roundup",2024-08-24
Where Will Apple Stock Be in 5 Years?,2024-08-24
Prediction: 2 Stocks That'll Be Worth More Than Apple 10 Years From Now,2024-08-24
Top 25 Eco-Friendly Companies in 2024,2024-08-23
10 Best American Stocks To Buy For Foreign Investors,2024-08-23
Mark Gurman does an about face and reports that the Apple iPhone event will take place on September 10th as the rumors suggested,2024-08-23
Apple's New Artificial Intelligence-Powered Phones Could Do Much More Than Boost iPhone Sales,2024-08-23
Apple Stock Seen Getting Lift From AI Opportunity,2024-08-23
Apple eyes Sept. 10 for launch event: BBG,2024-08-23
Why Apple Stock And This 'Recession-Proof' Leader Strengthen Market's Bull Case,2024-08-23
"Apple targets Sept. 10 debut for new iPhones, AirPods and watches, Bloomberg News reports",2024-08-23
"Apple Targets Sept. 10 Debut for New iPhones, AirPods and Watches",2024-08-23
"Loebs Third Point Adds Apple Shares, Still Cant Beat S&P 500",2024-08-23
"Meta 2Q24 Earnings, Thoughts on Meta HW Sales",2024-08-23
Apple addresses EU regulatory concerns with browser updates,2024-08-23
Warren Buffett's Biggest Bets in 2024: 40% of Berkshire Hathaway's $276.9 Billion Stock Portfolio Is Held in Just 2 Stocks,2024-08-23
Big Tech dominance is forcing index superpowers to rethink rules,2024-08-23
Apple Stock: Should Investors Take Some Profits Off the Table?,2024-08-23
62% of Warren Buffett's $314 Billion Portfolio Is Invested in These 4 Unstoppable Stocks,2024-08-23
Q2 2024 Opera Ltd Earnings Call,2024-08-23
Better Artificial Intelligence (AI) Stock: Microsoft vs. Apple,2024-08-23
"Under DMA probe, Apple tweaks design of EU browser choice screens, expands app default settings",2024-08-23
Apple supplier Pegatron's 2Q24 profit top 9-quarter high,2024-08-22
"Morgan Stanley reveals top stock picks, including Nvidia",2024-08-22
"Magnificent Seven Stocks: Nvidia Stock, Tesla Sell Off; Meta Eyes Buy Point",2024-08-22
Trade Tracker: Stephanie Link trims Apple,2024-08-22
"Apple to Let iPhone Users Delete Safari, Other Native Apps to Comply With EU Law",2024-08-22
Germany in real mess as manufacturing crisis spills over,2024-08-22
"Amazon Earnings, Amazon in the Home",2024-08-22
"Apple to update EU browser options, make more apps deletable",2024-08-22
"Under DMA probe, Apple tweaks design of EU browser choice screens, expands app default settings",2024-08-22
"A Big CEO Move, Big Buffett Buys, and More",2024-08-22
Interview: Snaps Qi Pan shares how computer vision is entering a golden age,2024-08-22
Billionaire Ken Griffin Nearly Doubled His Stake in Apple Stock in Q2. Here's Why It Could Pay Off Big Time.,2024-08-22
2 Artificial Intelligence (AI) Stocks That Could Help Make You a Fortune,2024-08-22
"Jim Cramer on Amazon.com, Inc. (AMZN): It's Making A Comeback'",2024-08-21
Jim Cramer on Alphabet Inc. (GOOG): I Like The Saga So Much; It Makes Me Happy.',2024-08-21
Jim Cramer on Apple Inc. (AAPL): Too Good To Let Go,2024-08-21
Apples App Store Head to Leave in Reorganization Amid Global Scrutiny,2024-08-21
Jim Cramer on United Rentals Inc. (URI): You've Got A Winner There',2024-08-21
ChatGPT: Everything you need to know about the AI-powered chatbot,2024-08-21
"Jim Cramer on Apple Inc. (AAPL): Apple Has Long Been An Own it, Dont Trade It Stock In My Eyes",2024-08-21
Apple Stock Is the Real Bargain in Big Tech. Its Not What You Think.,2024-08-21
Apple Is the Real Bargain in Big Tech. Its Not What You Think.,2024-08-21
Evidence of food price gouging is hard to find,2024-08-21
UK's competition authority ends probes of Apple and Google but will use incoming powers to 'resolve app store concerns',2024-08-21
Googles best bet to hold on to its search market share might be an ad campaign,2024-08-21
"Magnificent Seven Stocks: Nvidia Stock, Tesla Rally; Meta Eyes Buy Point",2024-08-21
Is Meta Stock A Buy As Facebook Parent Bounces Back From July Slump?,2024-08-21
"U.K. Authority Closes Competition Probes Into Google, Apple App Stores",2024-08-21
Tech Observations From My Vacation,2024-08-21
"UK Closes Google and Apple App Store Probes, Deferring to New Digital Competition Regime",2024-08-21
"As Nvidia recovers, Big Tech has led the way in summer rally",2024-08-21
UK watchdog drops Google and Apple app store investigations,2024-08-21
Baron Opportunity Fund Reinitiated a Position in Apple (AAPL) in Q2,2024-08-21
Nvidia Is One Of The Richest Public Wealth Fund's Biggest 9 Bets,2024-08-21
"Magnificent Seven Stocks Are Stumbling, Watch This for When to Sell Nvidia and Co. And 5 Other Things to Know Today.",2024-08-21
UK watchdog shuts down probes into Apple and Google app stores,2024-08-21
2 No-Brainer Warren Buffett Stocks to Buy Right Now,2024-08-21
Top CEOs stand by Business Roundtable shift to serve 'all of our stakeholders',2024-08-21
World's largest iPhone factory loses momentum amid supply chain diversification away from China,2024-08-21
Q2 2024 ATRenew Inc Earnings Call,2024-08-21
"The AI Trade Is Over, BofA Says. What to Buy Instead.",2024-08-21
Contactless acceptance  a natural consequence of ATM evolution,2024-08-21
Be Like Buffett and Sell Some Winners. How Options Strategies Can Help.,2024-08-21
Taiwan Semiconductor Manufacturing Company Limited (TSM): A Tech Stock to Monitor Amid Market Volatility According to Stacy Rasgon,2024-08-20
Apple Inc. (AAPL): An AI Stock You Should Not Miss,2024-08-20
"Trade Tracker: Bill Baruch trims multiple megacaps in his portfolio, including Apple and Nvidia",2024-08-20
"Nvidia helped the stock market storm back, but this summers broadening theme never went away",2024-08-20
Apple has 'enormous expectations' in its AI-tied valuation,2024-08-20
Is It A Sign? Warren Buffett's Latest Move With Apple Stock Is Still Puzzling Investors. But There May Be More Behind It,2024-08-20
Warren Buffett Stocks: What's Inside Berkshire Hathaway's Portfolio?,2024-08-20
Amazons AI Spending Plans Keep Stock From Joining Tech Rebound,2024-08-20
It Isn't Just Apple: Warren Buffett Could Be Souring on This Other Megacap Stock,2024-08-20
Microsoft's dominant 21st century offers a key lesson for stock market investors: Morning Brief,2024-08-20
"The Best ""Magnificent Seven"" Stock to Buy Right Now, According to Wall Street",2024-08-20
Samsung set to launch affordable flagship Galaxy S24 FE before new iPhone SE 4,2024-08-20
Apple modem chip for iPhone unlikely in 2025,2024-08-19
Apple Inc. (AAPL): This AI Stock Is Trending Right Now,2024-08-19
Apple iPhone 16: Speculation abounds about the latest phone and announcement date,2024-08-19
"Will Regulators Really Break Up Big Tech, or Are They Already Too Late?",2024-08-19
Apple Podcasts launches on the web,2024-08-19
GM Said To Be Cutting Jobs at Its Software and Services Unit,2024-08-19
"AI optimism may already be priced into Apple, says MoffettNathanson's Craig Moffett",2024-08-19
"GM Is Cutting More Than 1,000 Workers From Its Software Business",2024-08-19
Apple Is Set to Win in AI. How Thats Already Priced In.,2024-08-19
"Apple, Lineage, OneStream initiated: Wall Street's top analyst calls",2024-08-19
5 Dividend Growth Stocks to Buy and Hold Forever,2024-08-19
Why Apple Is Plowing Billions Of Dollars Into A Project That Won't Have A Payoff Near Term: Gurman Weighs In,2024-08-19
Superyachts are wreaking havoc on Mediterranean beaches because their dumped waste is washing ashore,2024-08-19
Warren Buffett's Panic Sale Of Apple Stock Cost $6.2 Billion,2024-08-19
The Art of Valuation: Discovering Apple Inc's Intrinsic Value,2024-08-19
These 3 Dow Stocks Are Set to Soar in 2024 and Beyond,2024-08-19
Prediction: This Will Be the Next Artificial Intelligence (AI) Chipmaker Stock to Join Nvidia in the Trillion-Dollar Club (Hint: It's Not Broadcom),2024-08-19
4 Reasons to Buy This ETF Like There's No Tomorrow,2024-08-19
3 Top Bargain Stocks Ready for a Bull Run,2024-08-19
Here Are All 10 Stocks Warren Buffett Is Selling,2024-08-19
Apple To Expand Indian Footprint As Tata Sets Up Country's 4th iPhone Assembly Plant: Report,2024-08-19
5 problems facing Apple it wont talk about at its April event,2024-08-19
Tim Cook Sees China's Future Bright For Apple  Describes China As 'The Most Competitive In The World',2024-08-18
"Prediction: This ""Magnificent Seven"" Stock Could Become the World's First $4 Trillion Company in 2024",2024-08-18
Warren Buffett Just Sold a Huge Chunk of Apple Stock. Should You Do the Same?,2024-08-18
What one AI CEO learned by working 20 feet from Apple's Steve Jobs,2024-08-18
4 Reasons to Follow Warren Buffett and Sell Apple Stock,2024-08-18
"5 big analyst AI moves: Dell new Top Pick at JPMorgan; QCOM, SNOW downgraded",2024-08-18
9 Best Financial Services Stocks To Buy Now,2024-08-18
"1 Stock I Wouldn't Touch With a 10-Foot Pole, Even After the Market Sell-Off Dropped Its Price",2024-08-17
This tantalizing symmetry in Warren Buffetts stock moves may be a clue on his Apple stake,2024-08-17
Apple has been sued for Copyright Infringement regarding Two Photographs illegally presented on Apple Music's website,2024-08-17
"Apple: Buy, Sell, or Hold?",2024-08-17
"Nvidia stock rises, Trump Media falls, and Warren Buffett's Apple selloff: Markets news roundup",2024-08-17
"Apple Opens Tap-to-Pay to Competitors, but Can They Take Advantage?",2024-08-17
"Warren Buffett's Apple tax bill, Nvidia's comeback, expensive colleges: The week's most popular stories",2024-08-17
"Apple's iPhones could see a strong Q3, explains Morgan Stanley's Erik Woodring",2024-08-16
These Big Tech Stocks Fell Out of Favor With Large Investors Before the Global Sell-Off,2024-08-16
Warren Buffett Stocks: What's Inside Berkshire Hathaway's Portfolio?,2024-08-16
"Epic Games launches app store, challenging Apples supremacy",2024-08-16
Apple TV+ has Officially Renewed its Sci-Fi thriller 'Dark Matter' for Season 2,2024-08-16
How Warren Buffett's Berkshire Hathaway Grew Its Cash Pile as It Sold More Stock,2024-08-16
"Magnificent Seven Stocks: Nvidia Stock, Tesla Rally",2024-08-16
AI Isnt Going to Sell iPhones and Google Pixels. At Least Not Yet.,2024-08-16
"Apples Hold on the App Store Is Loosening, at Least in Europe",2024-08-16
"'Fortnite' maker Epic Games launches its app store on iOS in the EU, worldwide on Android",2024-08-16
Expect more choppy action from Big Tech stocks: Analyst,2024-08-16
Analysts reset their targets after Cisco earnings,2024-08-16
Analysts reset Cisco stock price targets after earnings,2024-08-16
"Apple is in a generational upgrade cycle, says Melius' Ben Reitzes",2024-08-16
Investors Heavily Search Apple Inc. (AAPL): Here is What You Need to Know,2024-08-16
Here's Exactly How Many Apple Shares Warren Buffett Just Sold,2024-08-16
"Fortnite returns on iPhones in EU, globally on Android",2024-08-16
"Apple, Microsoft lead Wells Fargo's list of top stocks 'for all seasons'",2024-08-16
"GOOGL, AAPL, MSFT: Which Magnificent Seven Stock Is the Best Buy?",2024-08-16
"Apple reportedly developing large foldable devices, exploring the possibility of a foldable iPad",2024-08-15
Jim Cramer Says Taiwan Semiconductor Manufacturing Company Limited (TSM) Is A Solid Investment Despite Ongoing Concerns About Taiwan,2024-08-15
Billionaire Paul Singer Says Hes Staying Away from Apple (AAPL) and Other AI Bubble Stocks,2024-08-15
"Warren Buffett Still Holds 400M Apple Shares, Reveals New Investments In Ulta Beauty And Heico  Elon Musk Calls Berkshire Hathaway's $277B Cash Reserves 'Wild'",2024-08-15
Warren Buffett's Strategic Moves: A Deep Dive into Berkshire Hathaway's Latest 13F Filing,2024-08-15
Warren Buffett's Strategic Moves in Q2 2024: A Closer Look at Apple Inc's Impact,2024-08-15
Apple's Beats and Kim Kardashian Release their second collaboration bringing here 3-Popular Neutral Colors  to Beats Studio Pro,2024-08-15
What Apples Steve Jobs taught this CEO about leadership,2024-08-15
Klarna Debuts New Banking Features With Potential IPO Looming,2024-08-15
NIST Unveils New Encryption Algorithms: How Tech Companies Are Leading the Quantum Charge,2024-08-15
A Magic Number for Berkshire's Apple Stake?,2024-08-15
What Is Nancy Pelosi's Net Worth?,2024-08-15
"Tapestry, Nike, Apple: 3 Stocks in Focus",2024-08-15
"Soros, Druckenmiller Pared Megacap Holdings Ahead of Rout",2024-08-15
Google remains highest ranked for AI voice assistants,2024-08-15
"Is Meta Stock A Buy After Strong Q2 Results, AI Spending Growth?",2024-08-15
Berkshire Might Be Finished Selling Apple Stock. Heres How We Know.,2024-08-15
5 Things to Know Before the Stock Market Opens,2024-08-15
Apple Inc. (AAPL): An Important AI Stock You Should Pay Attention To,2024-08-15
Prediction: These 4 Future Technologies Will Be Millionaire-Makers -- and Here Are the Top Stocks to Buy Now to Profit From Them,2024-08-15
These stocks are surging as Warren Buffett reveals new stakes,2024-08-15
"Hedge Funds Add Apple, Reshuffle Technology Portfolio",2024-08-15
Prediction: 2 Stocks That Will Be Worth More Than Apple 5 Years From Now,2024-08-15
How the empire that Google built could be remade following monopoly ruling,2024-08-15
Daniel Loeb's Strategic Embrace of Apple Inc in Q2 2024,2024-08-14
"Warren Buffett Bet On Ulta Beauty, Heico in Q2. See How His Portfolio Changed.",2024-08-14
Warren Buffett's Major Portfolio Reshuffle: A Deep Dive into Apple's 20.13% Reduction,2024-08-14
"Warren Buffett's Firm Chops Apple Position, Enters Holdings in Ulta Beauty and Heico",2024-08-14
Heard on the Street: Google Stock Slumps as Breakup Worries Spoil Phone Party,2024-08-14
Google's new phone is more about showcasing its AI than the device itself,2024-08-14
Made By Google Event Leads Jefferies To Call Alphabet 'Top Pick' for Consumer AI,2024-08-14
"Magnificent Seven Stocks: Nvidia Stock Rallies; Tesla, Google Sell Off",2024-08-14
"Apple opens up NFC transactions to developers, but says there will be 'associated fees'",2024-08-14
Heard on the Street: Google Stock Slumps as Breakup Worries Spoil Phone Party,2024-08-14
Apple finally allows Spotify to show pricing info to EU users on iOS,2024-08-14
"Mairs and Power Amplifies Apple Stake in Q2 2024, Signaling Strategic Portfolio Adjustments",2024-08-14
Thoughts on the U.S. v. Google Verdict (Part 2),2024-08-14
Heard on the Street: Googles Phone Party Spoiled by Breakup Worries,2024-08-14
'Sheriff of Silicon Valley': How Kamala Harris's tenure as California AG could shape her approach to Big Tech,2024-08-14
Could the US Government Break Up Google After Monopoly Ruling?,2024-08-14
Warren Buffett Stocks: What's Inside Berkshire Hathaway's Portfolio?,2024-08-14
Tencent Says in Talks With Apple About Mini Games Mobile Revenue,2024-08-14
Prediction: Buffett's Decision to Offload Apple and Bank of America Stock Could Pay Off In Spades. Here's Why.,2024-08-14
"Starbucks CEO Faces a Cooling Economy, Value Shoppers. Why the Task Ahead Is Tough, And 5 Other Things to Know Today.",2024-08-14
Spotify to add price information in its app on Apple devices in EU,2024-08-14
Googles New Phones Arent Really About the Phones,2024-08-14
IPhone Maker Hon Hai Sees Sales Rising as AI Nudges Profit Up,2024-08-14
Apple continues developing affordable versions of Vision Pro and AR glasses amid mixed reception,2024-08-14
Apple Stock (NASDAQ:AAPL): 5 Bullish Signs and 1 Red Flag,2024-08-13
4 Takeaways From Alphabet's 'Made By Google' Launch Event,2024-08-13
Mag 7 Insiders Arent Buying Stock Dips,2024-08-13
Google rolls out Pixel 9 phones earlier than usual as AI race with Apple heats up,2024-08-13
"Paramount to shutter TV studio, begins layoffs in cost-cutting frenzy",2024-08-13
"Google Launches Pixel 9 Phones, Pixel Watch 3 in Renewed Push to Sell AI",2024-08-13
"Google Unveils Gemini AI Assistant, Pixel 9 Phones. Takes Aim At Apple IPhone 16 Launch.",2024-08-13
"Apple, Intel, And AMD Lead Charge In AI-Capable PC Market Surge: Report",2024-08-13
"With volatility ahead, invest in the Mag 7: Portfolio manager",2024-08-13
Google unveils new phones and other gadgets powered by AI,2024-08-13
"Google debuts Pixel smartphone lineup, including a new foldable phone, ahead of Apple's latest iPhone push",2024-08-13
Google To Take Wraps Off AI-Ready Pixel 9 Phones Ahead Of IPhone 16 Launch,2024-08-13
Googles Pixel Smartphone Event Is Here. What It Means for Alphabet Stock.,2024-08-13
Thoughts on the U.S. v. Google Verdict (Part 1),2024-08-13
Indian regulator orders recall of Apple antitrust investigation,2024-08-13
"AI PCs made up 14% of quarterly personal computer shipments, Canalys says",2024-08-13
Traders Hope Alphabets Pixel Event Can Stem $360 Billion Rout,2024-08-13
Jeremy Grantham's Strategic Moves in Q2 2024: A Closer Look at Apple Inc's Impact,2024-08-13
"Got $3,000? 3 Artificial Intelligence (AI) Stocks to Buy and Hold for the Long Term",2024-08-13
