article,date
Evidence of food price gouging is hard to find,2024-08-21
UK's competition authority ends probes of Apple and Google but will use incoming powers to 'resolve app store concerns',2024-08-21
Googles best bet to hold on to its search market share might be an ad campaign,2024-08-21
"Magnificent Seven Stocks: Nvidia Stock, Tesla Rally; Meta Eyes Buy Point",2024-08-21
Is Meta Stock A Buy As Facebook Parent Bounces Back From July Slump?,2024-08-21
"U.K. Authority Closes Competition Probes Into Google, Apple App Stores",2024-08-21
Tech Observations From My Vacation,2024-08-21
"UK Closes Google and Apple App Store Probes, Deferring to New Digital Competition Regime",2024-08-21
"As Nvidia recovers, Big Tech has led the way in summer rally",2024-08-21
UK watchdog drops Google and Apple app store investigations,2024-08-21
Baron Opportunity Fund Reinitiated a Position in Apple (AAPL) in Q2,2024-08-21
Nvidia Is One Of The Richest Public Wealth Fund's Biggest 9 Bets,2024-08-21
"Magnificent Seven Stocks Are Stumbling, Watch This for When to Sell Nvidia and Co. And 5 Other Things to Know Today.",2024-08-21
UK watchdog shuts down probes into Apple and Google app stores,2024-08-21
2 No-Brainer Warren Buffett Stocks to Buy Right Now,2024-08-21
Top CEOs stand by Business Roundtable shift to serve 'all of our stakeholders',2024-08-21
World's largest iPhone factory loses momentum amid supply chain diversification away from China,2024-08-21
Q2 2024 ATRenew Inc Earnings Call,2024-08-21
"The AI Trade Is Over, BofA Says. What to Buy Instead.",2024-08-21
Contactless acceptance  a natural consequence of ATM evolution,2024-08-21
Be Like Buffett and Sell Some Winners. How Options Strategies Can Help.,2024-08-21
Taiwan Semiconductor Manufacturing Company Limited (TSM): A Tech Stock to Monitor Amid Market Volatility According to Stacy Rasgon,2024-08-20
Apple Inc. (AAPL): An AI Stock You Should Not Miss,2024-08-20
"Trade Tracker: Bill Baruch trims multiple megacaps in his portfolio, including Apple and Nvidia",2024-08-20
"Nvidia helped the stock market storm back, but this summers broadening theme never went away",2024-08-20
Apple has 'enormous expectations' in its AI-tied valuation,2024-08-20
Is It A Sign? Warren Buffett's Latest Move With Apple Stock Is Still Puzzling Investors. But There May Be More Behind It,2024-08-20
Warren Buffett Stocks: What's Inside Berkshire Hathaway's Portfolio?,2024-08-20
Amazons AI Spending Plans Keep Stock From Joining Tech Rebound,2024-08-20
It Isn't Just Apple: Warren Buffett Could Be Souring on This Other Megacap Stock,2024-08-20
Microsoft's dominant 21st century offers a key lesson for stock market investors: Morning Brief,2024-08-20
"The Best ""Magnificent Seven"" Stock to Buy Right Now, According to Wall Street",2024-08-20
Samsung set to launch affordable flagship Galaxy S24 FE before new iPhone SE 4,2024-08-20
Apple modem chip for iPhone unlikely in 2025,2024-08-19
Apple Inc. (AAPL): This AI Stock Is Trending Right Now,2024-08-19
Apple iPhone 16: Speculation abounds about the latest phone and announcement date,2024-08-19
"Will Regulators Really Break Up Big Tech, or Are They Already Too Late?",2024-08-19
Apple Podcasts launches on the web,2024-08-19
GM Said To Be Cutting Jobs at Its Software and Services Unit,2024-08-19
"AI optimism may already be priced into Apple, says MoffettNathanson's Craig Moffett",2024-08-19
"GM Is Cutting More Than 1,000 Workers From Its Software Business",2024-08-19
Apple Is Set to Win in AI. How Thats Already Priced In.,2024-08-19
"Apple, Lineage, OneStream initiated: Wall Street's top analyst calls",2024-08-19
5 Dividend Growth Stocks to Buy and Hold Forever,2024-08-19
Why Apple Is Plowing Billions Of Dollars Into A Project That Won't Have A Payoff Near Term: Gurman Weighs In,2024-08-19
Superyachts are wreaking havoc on Mediterranean beaches because their dumped waste is washing ashore,2024-08-19
Warren Buffett's Panic Sale Of Apple Stock Cost $6.2 Billion,2024-08-19
The Art of Valuation: Discovering Apple Inc's Intrinsic Value,2024-08-19
These 3 Dow Stocks Are Set to Soar in 2024 and Beyond,2024-08-19
Prediction: This Will Be the Next Artificial Intelligence (AI) Chipmaker Stock to Join Nvidia in the Trillion-Dollar Club (Hint: It's Not Broadcom),2024-08-19
4 Reasons to Buy This ETF Like There's No Tomorrow,2024-08-19
3 Top Bargain Stocks Ready for a Bull Run,2024-08-19
Here Are All 10 Stocks Warren Buffett Is Selling,2024-08-19
Apple To Expand Indian Footprint As Tata Sets Up Country's 4th iPhone Assembly Plant: Report,2024-08-19
5 problems facing Apple it wont talk about at its April event,2024-08-19
Tim Cook Sees China's Future Bright For Apple  Describes China As 'The Most Competitive In The World',2024-08-18
"Prediction: This ""Magnificent Seven"" Stock Could Become the World's First $4 Trillion Company in 2024",2024-08-18
Warren Buffett Just Sold a Huge Chunk of Apple Stock. Should You Do the Same?,2024-08-18
What one AI CEO learned by working 20 feet from Apple's Steve Jobs,2024-08-18
4 Reasons to Follow Warren Buffett and Sell Apple Stock,2024-08-18
"5 big analyst AI moves: Dell new Top Pick at JPMorgan; QCOM, SNOW downgraded",2024-08-18
9 Best Financial Services Stocks To Buy Now,2024-08-18
"1 Stock I Wouldn't Touch With a 10-Foot Pole, Even After the Market Sell-Off Dropped Its Price",2024-08-17
This tantalizing symmetry in Warren Buffetts stock moves may be a clue on his Apple stake,2024-08-17
Apple has been sued for Copyright Infringement regarding Two Photographs illegally presented on Apple Music's website,2024-08-17
"Apple: Buy, Sell, or Hold?",2024-08-17
"Nvidia stock rises, Trump Media falls, and Warren Buffett's Apple selloff: Markets news roundup",2024-08-17
"Apple Opens Tap-to-Pay to Competitors, but Can They Take Advantage?",2024-08-17
"Warren Buffett's Apple tax bill, Nvidia's comeback, expensive colleges: The week's most popular stories",2024-08-17
"Apple's iPhones could see a strong Q3, explains Morgan Stanley's Erik Woodring",2024-08-16
These Big Tech Stocks Fell Out of Favor With Large Investors Before the Global Sell-Off,2024-08-16
Warren Buffett Stocks: What's Inside Berkshire Hathaway's Portfolio?,2024-08-16
"Epic Games launches app store, challenging Apples supremacy",2024-08-16
Apple TV+ has Officially Renewed its Sci-Fi thriller 'Dark Matter' for Season 2,2024-08-16
How Warren Buffett's Berkshire Hathaway Grew Its Cash Pile as It Sold More Stock,2024-08-16
"Magnificent Seven Stocks: Nvidia Stock, Tesla Rally",2024-08-16
AI Isnt Going to Sell iPhones and Google Pixels. At Least Not Yet.,2024-08-16
"Apples Hold on the App Store Is Loosening, at Least in Europe",2024-08-16
"'Fortnite' maker Epic Games launches its app store on iOS in the EU, worldwide on Android",2024-08-16
Expect more choppy action from Big Tech stocks: Analyst,2024-08-16
Analysts reset their targets after Cisco earnings,2024-08-16
Analysts reset Cisco stock price targets after earnings,2024-08-16
"Apple is in a generational upgrade cycle, says Melius' Ben Reitzes",2024-08-16
Investors Heavily Search Apple Inc. (AAPL): Here is What You Need to Know,2024-08-16
Here's Exactly How Many Apple Shares Warren Buffett Just Sold,2024-08-16
"Fortnite returns on iPhones in EU, globally on Android",2024-08-16
"Apple, Microsoft lead Wells Fargo's list of top stocks 'for all seasons'",2024-08-16
"GOOGL, AAPL, MSFT: Which Magnificent Seven Stock Is the Best Buy?",2024-08-16
"Apple reportedly developing large foldable devices, exploring the possibility of a foldable iPad",2024-08-15
Jim Cramer Says Taiwan Semiconductor Manufacturing Company Limited (TSM) Is A Solid Investment Despite Ongoing Concerns About Taiwan,2024-08-15
Billionaire Paul Singer Says Hes Staying Away from Apple (AAPL) and Other AI Bubble Stocks,2024-08-15
"Warren Buffett Still Holds 400M Apple Shares, Reveals New Investments In Ulta Beauty And Heico  Elon Musk Calls Berkshire Hathaway's $277B Cash Reserves 'Wild'",2024-08-15
Warren Buffett's Strategic Moves: A Deep Dive into Berkshire Hathaway's Latest 13F Filing,2024-08-15
Warren Buffett's Strategic Moves in Q2 2024: A Closer Look at Apple Inc's Impact,2024-08-15
Apple's Beats and Kim Kardashian Release their second collaboration bringing here 3-Popular Neutral Colors  to Beats Studio Pro,2024-08-15
What Apples Steve Jobs taught this CEO about leadership,2024-08-15
Klarna Debuts New Banking Features With Potential IPO Looming,2024-08-15
NIST Unveils New Encryption Algorithms: How Tech Companies Are Leading the Quantum Charge,2024-08-15
A Magic Number for Berkshire's Apple Stake?,2024-08-15
What Is Nancy Pelosi's Net Worth?,2024-08-15
"Tapestry, Nike, Apple: 3 Stocks in Focus",2024-08-15
"Soros, Druckenmiller Pared Megacap Holdings Ahead of Rout",2024-08-15
Google remains highest ranked for AI voice assistants,2024-08-15
"Is Meta Stock A Buy After Strong Q2 Results, AI Spending Growth?",2024-08-15
Berkshire Might Be Finished Selling Apple Stock. Heres How We Know.,2024-08-15
5 Things to Know Before the Stock Market Opens,2024-08-15
Apple Inc. (AAPL): An Important AI Stock You Should Pay Attention To,2024-08-15
Prediction: These 4 Future Technologies Will Be Millionaire-Makers -- and Here Are the Top Stocks to Buy Now to Profit From Them,2024-08-15
These stocks are surging as Warren Buffett reveals new stakes,2024-08-15
"Hedge Funds Add Apple, Reshuffle Technology Portfolio",2024-08-15
Prediction: 2 Stocks That Will Be Worth More Than Apple 5 Years From Now,2024-08-15
How the empire that Google built could be remade following monopoly ruling,2024-08-15
Daniel Loeb's Strategic Embrace of Apple Inc in Q2 2024,2024-08-14
"Warren Buffett Bet On Ulta Beauty, Heico in Q2. See How His Portfolio Changed.",2024-08-14
Warren Buffett's Major Portfolio Reshuffle: A Deep Dive into Apple's 20.13% Reduction,2024-08-14
"Warren Buffett's Firm Chops Apple Position, Enters Holdings in Ulta Beauty and Heico",2024-08-14
Heard on the Street: Google Stock Slumps as Breakup Worries Spoil Phone Party,2024-08-14
Google's new phone is more about showcasing its AI than the device itself,2024-08-14
Made By Google Event Leads Jefferies To Call Alphabet 'Top Pick' for Consumer AI,2024-08-14
"Magnificent Seven Stocks: Nvidia Stock Rallies; Tesla, Google Sell Off",2024-08-14
"Apple opens up NFC transactions to developers, but says there will be 'associated fees'",2024-08-14
Heard on the Street: Google Stock Slumps as Breakup Worries Spoil Phone Party,2024-08-14
Apple finally allows Spotify to show pricing info to EU users on iOS,2024-08-14
"Mairs and Power Amplifies Apple Stake in Q2 2024, Signaling Strategic Portfolio Adjustments",2024-08-14
Thoughts on the U.S. v. Google Verdict (Part 2),2024-08-14
Heard on the Street: Googles Phone Party Spoiled by Breakup Worries,2024-08-14
'Sheriff of Silicon Valley': How Kamala Harris's tenure as California AG could shape her approach to Big Tech,2024-08-14
Could the US Government Break Up Google After Monopoly Ruling?,2024-08-14
Warren Buffett Stocks: What's Inside Berkshire Hathaway's Portfolio?,2024-08-14
Tencent Says in Talks With Apple About Mini Games Mobile Revenue,2024-08-14
Prediction: Buffett's Decision to Offload Apple and Bank of America Stock Could Pay Off In Spades. Here's Why.,2024-08-14
"Starbucks CEO Faces a Cooling Economy, Value Shoppers. Why the Task Ahead Is Tough, And 5 Other Things to Know Today.",2024-08-14
Spotify to add price information in its app on Apple devices in EU,2024-08-14
Googles New Phones Arent Really About the Phones,2024-08-14
IPhone Maker Hon Hai Sees Sales Rising as AI Nudges Profit Up,2024-08-14
Apple continues developing affordable versions of Vision Pro and AR glasses amid mixed reception,2024-08-14
Apple Stock (NASDAQ:AAPL): 5 Bullish Signs and 1 Red Flag,2024-08-13
4 Takeaways From Alphabet's 'Made By Google' Launch Event,2024-08-13
Mag 7 Insiders Arent Buying Stock Dips,2024-08-13
Google rolls out Pixel 9 phones earlier than usual as AI race with Apple heats up,2024-08-13
"Paramount to shutter TV studio, begins layoffs in cost-cutting frenzy",2024-08-13
"Google Launches Pixel 9 Phones, Pixel Watch 3 in Renewed Push to Sell AI",2024-08-13
"Google Unveils Gemini AI Assistant, Pixel 9 Phones. Takes Aim At Apple IPhone 16 Launch.",2024-08-13
"Apple, Intel, And AMD Lead Charge In AI-Capable PC Market Surge: Report",2024-08-13
"With volatility ahead, invest in the Mag 7: Portfolio manager",2024-08-13
Google unveils new phones and other gadgets powered by AI,2024-08-13
"Google debuts Pixel smartphone lineup, including a new foldable phone, ahead of Apple's latest iPhone push",2024-08-13
Google To Take Wraps Off AI-Ready Pixel 9 Phones Ahead Of IPhone 16 Launch,2024-08-13
Googles Pixel Smartphone Event Is Here. What It Means for Alphabet Stock.,2024-08-13
Thoughts on the U.S. v. Google Verdict (Part 1),2024-08-13
Indian regulator orders recall of Apple antitrust investigation,2024-08-13
"AI PCs made up 14% of quarterly personal computer shipments, Canalys says",2024-08-13
Traders Hope Alphabets Pixel Event Can Stem $360 Billion Rout,2024-08-13
Jeremy Grantham's Strategic Moves in Q2 2024: A Closer Look at Apple Inc's Impact,2024-08-13
"Got $3,000? 3 Artificial Intelligence (AI) Stocks to Buy and Hold for the Long Term",2024-08-13
Samsungs AI Phone Boost Might Be Fading. Whats in Store for Apple.,2024-08-13
5 Things to Know Before the Stock Market Opens,2024-08-13
ExecThread Ranks No. 524 on the Inc. 5000 List of America's Fastest Growing Companies,2024-08-13
India Watchdog to Retract Report Alleging Apple Market Abuse,2024-08-13
"Here's the ""Magnificent Seven"" Stock I'm Loading Up On During the Current Market Sell-Off",2024-08-13
Apple Inc (AAPL): A Detailed Analysis of Its Market Position and Growth Potential in the Computer Hardware Sector,2024-08-13
"1 Unstoppable Stock Set to Join Nvidia, Apple, Microsoft, Amazon, Alphabet, and Meta in the $1 Trillion Club",2024-08-13
"Warren Buffett may have heeded this sell signal on Apple stock: While market cap quadrupled, profits only doubled",2024-08-13
Are Magnificent 7 valuations attractive again?,2024-08-12
What Broke and What Got Stronger Amid the Market's Summer Storm,2024-08-12
Apple says Patreon must switch to its billing system or risk removal from App Store,2024-08-12
Patreon Says It Must Use Apples Payment System Or Risk Removal,2024-08-12
What To Expect From Google's Launch Event Tuesday,2024-08-12
Wolfe Research downgrades Qualcomm over Apple's chip plans,2024-08-12
Google Looks to Get Jump on Apple With Earlier Pixel Launch,2024-08-12
Qualcomm Stock Faces Apple Risk. One Bull Is Gone.,2024-08-12
Non-Mag 7 equities are a 'once in a generation opportunity',2024-08-12
The Best Costco Finds This Week,2024-08-12
Magnificent Seven Stocks: Nvidia Stock Rallies; Tesla Slides,2024-08-12
"Apple Stock Faces Buffett, Google Headwinds. Why the iPhone Matters More.",2024-08-12
"AI Could Help the iPhone 16 Drive an Apple Renaissance, Wedbush Says",2024-08-12
Jim Cramer on Apple Inc. (AAPL): The Usual Suspect of The Magnificent 7,2024-08-12
Is Qualcomm a Millionaire-Maker Stock?,2024-08-12
5 Things to Know Before the Stock Market Opens,2024-08-12
Wedbush: This iPhone upgrade cycle could set stage for Apple supercycle,2024-08-12
Watch These XLK Tech Sector ETF Price Levels Amid Recent Volatility,2024-08-11
OLED iPad supply chain shift: LGD expands as SDC rumored to scale back,2024-08-11
QUALCOMM Incorporated (QCOM): Among Morgan Stanley's Top Humanoid Robot Stock Picks,2024-08-11
STMicroelectronics N.V. (STM): Morgan Stanley is Bullish on This Humanoid Robot Stock Now,2024-08-11
Should Apple Acquire Peloton in 2024? 2 Things Investors Need to Know.,2024-08-11
Apple Fans are likely to see Meaningful upgrades coming to Apple's 2025 iPhone Lineup,2024-08-11
Warren Buffett Declares Shift: Selling Apple Stock To Invest In This 'Magnificent' Megacap  Here's Why,2024-08-11
Should You Buy Alphabet Stock Following Its Antitrust Defeat? 3 Tech Watchers Weigh In.,2024-08-11
Warren Buffett Just Trimmed His Apple Stock. Should You?,2024-08-11
"Nvidia Is Dominating the Artificial Intelligence Chip Market, but Apple Has Been Securing Supply From Another Tech Giant",2024-08-11
"Should You Invest in ETFs or Just Own Shares of Nvidia, Apple, and Microsoft?",2024-08-11
"Foxconn adds 50,000 workers in Zhengzhou plant as it prepares for Apple's iPhone 16 launch",2024-08-11
Apple Inc. (AAPL): Warren Buffett and Hedge Funds Are Crazy About This Stock Now,2024-08-11
"Prediction: 1 Unstoppable Stock Could Join Microsoft, Apple, Nvidia, Alphabet, Amazon, and Meta in the $1 Trillion Club by 2034",2024-08-11
Warren Buffetts sale of 510 million Apple shares will go down as one of the best bets of his career,2024-08-11
Prediction: 3 Stocks That'll Be Worth More Than Amazon 10 Years From Now,2024-08-11
15 Smartphone Companies with the Largest Market Share in 2024,2024-08-10
"Amazon.com, Inc. (AMZN): Are Street Analysts Bullish on This AI Stock Now?",2024-08-10
Microsoft Corporation (MSFT): The Best AI Stock According to Financial Media?,2024-08-10
"Is Meta Platforms, Inc. (META) the Best AI Stock to Buy According to Hedge Funds?",2024-08-10
Warren Buffett Just Sold Half of His Apple Stock. 3 Reasons Not to Panic.,2024-08-10
"Is Intuitive Surgical, Inc. (ISRG) a Good Artificial Intelligence Stock to Buy Now?",2024-08-10
Apple Gets Caught Up in Market Sell-Off. Is It Time to Buy the Dip in the Stock?,2024-08-10
10 Best Artificial Intelligence (AI) Stocks To Buy According to Financial Media,2024-08-10
20 Industrial Stocks Already Riding the AI Wave,2024-08-10
Warren Buffett Just Sent a $277 Billion Warning to Stock Investors,2024-08-10
Apple Says No to Nvidia GPUs. Is This the End for Nvidia?,2024-08-10
2 Stocks to Buy In a Stock Market Sell-Off,2024-08-10
"AAPL Stock Outlook: While Apple's AI Plans Are Promising, Wait for a Better Entry Point",2024-08-10
Stock-Split Watch: 2 AI Stocks That Look Ready to Split,2024-08-10
EchoStar Corporation (NASDAQ:SATS) Q2 2024 Earnings Call Transcript,2024-08-10
3 Stocks to Pounce on as Consumer Confidence Rises,2024-08-10
Intel is the latest Fortune 500 giant to test the 4 wrong CEOs rule,2024-08-10
Prediction: These Will Be Warren Buffett's Top-5 Stocks in 2025,2024-08-10
Prediction: This Stock Will Be Warren Buffett's Top Performer by 2030,2024-08-10
"The Score: Apple, Walt Disney, Eli Lilly and More Stocks That Defined the Week",2024-08-09
Warren Buffett Just Cut Half of Berkshire Hathaway's Stake in Apple. Why?,2024-08-09
"Volatile week for stocks, where investors are buying: Catalysts",2024-08-09
Apple changes app store policy after EU Commission findings,2024-08-09
Apple reportedly has a new Mac Mini: 3 thing you need to know,2024-08-09
3 stocks retail investors turned to when stocks fell this week,2024-08-09
"Google Has Been Ruled a Monopoly. On the Internet, It May Not Matter.",2024-08-09
"Apple 3Q24 10-Q Takeaways, A Few Interesting Tidbits About Apple's Share Buyback, Apple's Free Cash Flow Margin",2024-08-09
Strategist: Why Meta looks like the 'Magnificent 7' standout right now,2024-08-09
Heres this strategists top 'Magnificent 7' stock to buy after the rout,2024-08-09
"Apple Defies Tech Sell-Off With Strong Earnings, AI Momentum",2024-08-09
Buffetts Apple Share Dump Is Set to Reshape Major Stock Gauges,2024-08-09
"Spotify and Epic Games call Apple's revised DMA compliance plan 'confusing,' 'illegal' and 'unacceptable'",2024-08-09
"TSMC July Sales Jump 45%, Buoyed by Strong AI Chip Demand",2024-08-09
5 Things to Know Before the Stock Market Opens,2024-08-09
"These Were the 5 Biggest Companies in 2014, and Here Are the 5 Biggest Companies Now",2024-08-09
3 Warren Buffett Stocks to Buy During the Stock Market Sell-Off Without Any Hesitation,2024-08-09
"1 Unstoppable Stock That Could Join Apple, Microsoft, Nvidia, Alphabet, Amazon, and Meta in the $1 Trillion Club",2024-08-09
ByteDance Is Said to Seek Refinancing of $5 Billion Loan,2024-08-08
Google's antitrust case loss affects Apple; may accelerate expansion of AI search market,2024-08-08
A Crackdown Is Coming for People Hanging On to Student Discounts,2024-08-08
Apple's AI playbook,2024-08-08
"Apple revises DMA compliance for App Store link-outs, applying fewer restrictions and a new fee structure",2024-08-08
Apple could charge up to $20 for Apple Intelligence features,2024-08-08
Apple changes EU app store policy after Commission probe,2024-08-08
"Midday movers: Eli Lilly, Robinhood and Zillow rise; Warner Bros, Fastly, Bumble fall",2024-08-08
"Apple's Satellite Connectivity Provider Globalstar's Q2 Revenue Grows 10% On Wholesale Capacity Surge, Hikes FY24 Outlook",2024-08-08
47 Apple patent applications were published today covering a Native Apple AI Network Architecture and more,2024-08-08
"Magnificent Seven Stocks: Nvidia Stock, Tesla Rally; Meta Retakes Key Level",2024-08-08
"In 2021, Charlie Munger Told Warren Buffett It Was A Mistake To Sell Apple Shares. Will He Be Right Again?",2024-08-08
Warren Buffett's Berkshire Hathaway Just Dumped Half Its Stake in Apple Stock. What Investors Need to Know,2024-08-08
"Eli Lilly, Robinhood and Zillow rose premarket; Warner Bros, Fastly, Bumble fall",2024-08-08
Did You Catch the Good News From PayPal?,2024-08-08
Top investor's best 'Magnificent 7' stock to buy right now,2024-08-08
1 Growth Stock Down 6% to Buy Right Now,2024-08-08
This Incredibly Cheap Artificial Intelligence (AI) Stock Could Be About to Go on a Bull Run,2024-08-08
These Analysts Think Apple (AAPL) is Still One of the Best AI Stocks to Buy Now,2024-08-08
Prediction: This Hypergrowth Company Will Be Wall Street's First $6 Trillion Stock -- and It's Not Nvidia!,2024-08-08
"US futures, jobless claims, Apple - what's moving markets",2024-08-08
Think You Know Apple? Here's 1 Little-Known Fact You Can't Overlook.,2024-08-08
Expanding the Cloud for AI,2024-08-08
Indian Motherson reportedly to form JV with BIEL in supplying iPhone glasses,2024-08-07
"Apple Original Films has already tapped writer, director and producer Jon Watts to write a sequel to 'Wolfs' that is set to debut in September",2024-08-07
"The Carry Trade, the Nikkei, and Your Portfolio",2024-08-07
Apple's Chinese Tablet Competitor Huawei has released a new 12.2' Pro model with a High End OLED Display at an affordable price,2024-08-07
Apple Is the Big Loser in Googles Antitrust Battle,2024-08-07
"Google Antitrust Ruling Is a Negative for Its Credit and Apples, Moodys Says",2024-08-07
"MSFT, GOOGL, META, AMZN, AAPL: Big Techs Big Spend on AI",2024-08-07
Why you may want to wait to buy a new iPhone,2024-08-07
"Google Has Been Ruled a Monopoly. On the Internet, It May Not Matter.",2024-08-07
Big Tech is in 'penalty box' for now: Barclays strategist,2024-08-07
Some European users will get access to Apple Intelligence after all,2024-08-07
Apple could lose $20bn in Google search antitrust ruling,2024-08-07
Best Stock to Buy Right Now: Amazon vs. Apple,2024-08-07
Jim Cramer: Market Will Never Give Apple Inc (AAPL) Benefit of the Doubt,2024-08-07
Warren Buffett Just Sold $90 Billion of Apple Stock. Could This Be the Biggest Investing Mistake He's Ever Made?,2024-08-07
"Nasdaq Market Correction: 1 ""Magnificent Seven"" Stock to Buy Now, and Another to Avoid",2024-08-07
India antitrust watchdog reportedly finds Apple abusing market dominance,2024-08-06
"Recession outlook, tech trade, Zoetis CFO: Market Domination",2024-08-06
Googles unlawful grip on search could shatter its market dominance,2024-08-06
"A judge has branded Google a monopolist, but AI may bring about quicker change in internet search",2024-08-06
A Microsoft victory and Mozilla defeat: The fallout from Googles antitrust saga,2024-08-06
Apple Intelligence's writing tools stumble on swears and controversial topics,2024-08-06
Google Says It Will Appeal Antitrust Ruling What That Could Mean for Big Tech,2024-08-06
"Made by Google 2024: Pixel 9, Gemini, a new foldable and other things to expect from the event",2024-08-06
"These Stocks Moved the Most Today: Palantir, Nvidia, Uber, Caterpillar, CrowdStrike, Lumen, Kenvue, ZoomInfo, and More",2024-08-06
"Big Tech stocks: It's time to go bargain hunting, analyst says",2024-08-06
Google antitrust ruling may pose $20 billion risk for Apple,2024-08-06
Analysts review Apple stock price hit from Google antitrust ruling,2024-08-06
Trade Tracker: Kevin Simpson buys American Express and more Apple,2024-08-06
"These Stocks Are Moving the Most Today: Palantir, Nvidia, Uber, Caterpillar, CrowdStrike, Lumen, Kenvue, ZoomInfo, and More",2024-08-06
"Markets eye rebound, Google loses antitrust suit: Catalysts",2024-08-06
"If You'd Invested $5,000 in Apple Stock 5 Years Ago, Here's How Much You'd Have Today",2024-08-06
Google monopoly ruling could help Apple defense in antitrust case,2024-08-06
Heard on the Street: Googles Loss Doesnt Have Wall Street Worried Yet,2024-08-06
Tech had a rough day. But dont call it a dot-com meltdown moment yet,2024-08-06
"We know the Google antitrust ruling is huge, but we dont know what it really means yet",2024-08-06
Google search antitrust ruling could hurt iPhone maker Apple,2024-08-06
Breaking up Google would offer a chance to remodel the web,2024-08-06
"Buffett Slashes AAPL Stake in Half, What's Really Going On?, Removing the Buffett Overhang",2024-08-06
Wall Street sees 'buying opportunity' amid AI pullback,2024-08-06
"Apple Stock Slips, Microsoft Gains. What Googles Antitrust Loss Means for Big Tech.",2024-08-06
Big Tech Traders Struggle to Find Reasons to Buy This Dip,2024-08-06
Google and Apple Can Afford to Play Long Game After Antitrust Ruling,2024-08-06
"Are the AI, tech trades still the move after Mag 7 losses?",2024-08-06
Bearish Trade On Apple Could Return 23% In Less Than 7 Weeks,2024-08-06
"These Stocks Are Moving the Most Today: Palantir, Nvidia, Uber, Caterpillar, CrowdStrike, Apple, Lumen, Lucid, ZoomInfo, and More",2024-08-06
