article,date
"Don't see AI having a big impact on Apple this year or next, says LightShed Partners' Walter Piecyk",2024-08-06
Warren Buffett Leaves 4 Investors Holding The Bag On Apple Stock,2024-08-06
"Apple Stock Slips, Microsoft Gains. What Googles Antitrust Loss Means for Big Tech.",2024-08-06
Google Loses Antitrust Case. Judge Says Its a Monopolist.,2024-08-06
Big Tech Traders Struggle to Find Reasons to Buy This Dip,2024-08-06
Is It Too Late to Buy Apple Stock?,2024-08-06
Warren Buffett Is Selling Apple Stock and Buying This Magnificent Megacap Stock Instead,2024-08-06
Berkshire Hathaway Stock (NYSE:BRK.B): Dont Panic Following Halving of Apple Stake,2024-08-06
"Berkshire's selling of Apple was 'risk management' decision, says Glenview's Bill Stone",2024-08-05
"Apple, Nvidia lead big tech selloff",2024-08-05
AI gamble looms large as Apple seeks to revive iPhone sales in China,2024-08-05
"Forget Apple, the biggest loser in the Google search ruling could be Mozilla and its Firefox web browser",2024-08-05
"Nvidia, Microsoft, and Apple Could Help This Stock-Split ETF Turn $400 per Month Into $1 Million",2024-08-05
How an Investing Strategy in Japan Spurred a Global Market Rout,2024-08-05
Apples Shift to AI Is Poised to Soften Blow From Google Ruling,2024-08-05
"Google Broke Antitrust Law With Search Monopoly, Federal Judge Rules",2024-08-05
Google's antitrust loss could put billions at risk for Apple,2024-08-05
"Google's search monopoly, El-Erian talks the Fed: Market Domination",2024-08-05
'Magnificent Seven' Losses Approach $3 Trillion Amid Weeks-Long Selloff,2024-08-05
Magnificent Seven stocks shed over $600 billion during selloffNvidia hit hardest,2024-08-05
"Berkshire was too concentrated in Apple, says NYU's Aswath Damodaran",2024-08-05
Apple Has a Terrible Day as Big Tech Gets Slammed,2024-08-05
Market Meltdown: Is This 1999 All Over Again?,2024-08-05
Bets on emergency US rate cut ramp up as recession fears grow,2024-08-05
Federal Judge Rules Against Google In Antitrust Case. Will Apple Deal Be Impacted?,2024-08-05
S&P 500 Is Pummeled in Worst Day Since 2022 as Tech Stocks Dive,2024-08-05
"Nvidia, Apple stocks drop as tech sector tumbles",2024-08-05
All eyes are on the future of the tech trade during sell-off,2024-08-05
Apple Stock Slides After Warren Buffett's Berkshire Hathaway Cuts Stake,2024-08-05
Google loses antitrust trial in major blow to tech giant,2024-08-05
"These Stocks Are Moving the Most Today: Nvidia, Super Micro, Apple, Intel, Palantir, Amazon, and More",2024-08-05
"Magnificent Seven Stocks Roiled: Nvidia Plunges On AI Chip Delay; Apple, Tesla Dive",2024-08-05
Berkshire Hathaway cuts Apple position: Here's what you should know,2024-08-05
Warren Buffetts stock empire loses $15bn in global market crash,2024-08-05
"Apple, Krystal Biotech fall; Tyson Foods, Kellanova rise, Monday, 8/5/2024",2024-08-05
Why Apple Stock Got Crushed on Monday,2024-08-05
"Top Stock Movers Now: Nvidia, Apple, Kellanova, and More",2024-08-05
These Stocks Are Moving the Most Today,2024-08-05
"Magnificent Seven Stocks Roiled: Nvidia Plunges On AI Chip Delay; Apple, Tesla Dive",2024-08-05
Apple Stock Falls Amid Broad Selloff as Berkshire Hathaway Trims Stake Again,2024-08-05
"Apple Joins The Increased AI Spending Trend But As Always, With A Unique Take",2024-08-05
S&P 500 Is on Track for Worst Day Since 2022 as Tech Stocks Dive,2024-08-05
The two tech stocks to buy despite major sector sell-off,2024-08-05
"Midday movers: Apple, Nvidia, Intel, Coinbase and Moderna fall",2024-08-05
"Warren Buffett's moves on Apple 'make a lot of sense' to me right now, says Maxim Group's Tom Forte",2024-08-05
Why this market pullback may be good for Big Tech,2024-08-05
Warren Buffett Stocks: What's Inside Berkshire Hathaway's Portfolio?,2024-08-05
"Stocks to Watch Monday: Kellanova, Nvidia, Apple, Tesla",2024-08-05
Apple Stock Leads Big Tech Drop. Worries About an AI Bubble Are Back.,2024-08-05
"Im skipping the iPhone 16 compelling upgrade cycle  and refusing to give up my battered iPhone 12. Sorry, Apple.",2024-08-05
Heres Why Bulls are Wrong About Apple (AAPL)  And Probably Why Warren Buffett is Dumping the Stock,2024-08-05
Warren Buffett's Berkshire Hathaway slashes Apple stake,2024-08-05
Why Apple (AAPL) International Revenue Trends Deserve Your Attention,2024-08-05
"Market sell-off, tech takes hit, bitcoin falls: 3 Things",2024-08-05
"Amazon, Microsoft, Alphabet Spent More on AI than Expected. This Is What It Did to the Stocks.",2024-08-05
"These Stocks Are Moving the Most Today: Nvidia, Super Micro, Apple, Intel, Kellanova, Palantir, Coinbase, AMC, and More",2024-08-05
"Magnificent Seven set to shed $1 trillion in value, led by Apple, Nvidia",2024-08-05
Is Apple Stock A Buy Or Sell As Warren Buffett Slashes Stake?,2024-08-05
Navigating Market Uncertainty: Intrinsic Value of Apple Inc,2024-08-05
"Now not the time to panic on the tech trade, bargain hunt after selloff: Wedbush",2024-08-05
DSA vs. DMA: How Europe's twin digital regulations are hitting Big Tech,2024-08-05
5 Things to Know Before the Stock Market Opens,2024-08-05
Apple shares plunge after Berkshire cuts stake,2024-08-05
"Nvidia, Microsoft, or Apple: Which $3 Trillion-Dollar Stock Is the Better Artificial Intelligence (AI) Play?",2024-08-05
Warren Buffett's Selling Over $3.8 Billion Worth of Bank of America Stock in 2 Weeks Is an Ominous and Unmistakable Warning for Wall Street,2024-08-05
Apple Could Help Add These 2 Unstoppable Stocks to the $1 Trillion Club,2024-08-05
Huawei reportedly to introduce shared memory for next PC chip,2024-08-05
Apple Supplier Stocks Slump After Berkshire Nearly Halves Stake,2024-08-05
Apple faces tough road ahead in China despite growing revenue,2024-08-04
What Buffett's huge Apple sale really means,2024-08-04
"Buffett's Berkshire cuts Apple stake by half, boosts cash stockpile to $277B as it gets 'defensive",2024-08-04
Is Nvidia Stock a Buy Now?,2024-08-04
'Warren Crushed Apple' Says Jim Cramer As Buffett Cuts Stake In Tech Giant By Nearly Half: Here's How Much Dividend Income Berkshire Forgoes,2024-08-04
Berkshire Hathaway sold half of its Apple stock,2024-08-04
These 2 Dow Stocks Are Set to Soar in 2024 and Beyond,2024-08-04
Apple Investors Urged to Stay Calm After Buffett Slashes Stake,2024-08-04
Samsung's executive chairman Lee Jae-yong's disapproval of the company designers copying the Apple Watch Ultra is incredulous,2024-08-04
72% of Warren Buffett's Berkshire Hathaway Portfolio Is Invested in These 5 Dividend Stocks,2024-08-04
Buffett a 'core believer' in Apple - Wedbush,2024-08-04
"OpenAI Is Launching a Search Engine, but Don't Sell Your Alphabet (Google) Stock Just Yet",2024-08-04
"1 Unstoppable Stock That Could Join Apple, Microsoft, Nvidia, Alphabet, Amazon, and Meta in the $1 Trillion Club",2024-08-03
"Apple, E-Commerce Giant Lead Five Stocks Near Buy Points",2024-08-03
Key Takeaways From Berkshire Hathaway's Earnings,2024-08-03
Warren Buffetts Berkshire Hathaway Slashes Apple Stake,2024-08-03
Warning: Warren Buffett is selling stocks. A lot,2024-08-03
Warren Buffett's Berkshire sold nearly half of its Apple stake,2024-08-03
Berkshire Hathaway Slashes Apple Stake by Nearly 50%,2024-08-03
Is Apple Stock a Buy?,2024-08-03
What We Learned From Big Tech Earnings in the Past Week,2024-08-03
Apple Just Exposed a Massive Risk for Nvidia Stock,2024-08-03
Warren Buffett Doesn't Understand Artificial Intelligence (AI). But It Could Soon Make Him a Boatload of Money.,2024-08-03
"Prediction: 2 Growth Stocks (Under $100 Billion) Will Join Nvidia, Apple, and Microsoft as $1 Trillion Companies by 2040",2024-08-03
Intel needs 'a lot of things' to play in their favor in restructuring bid: Analyst,2024-08-02
"Apple's 3Q24 Earnings, The iPhone Is a Powder Keg",2024-08-02
"The Score: CrowdStrike, Apple, Intel and More Stocks That Defined the Week",2024-08-02
"These Stocks Moved the Most Today: Intel, Amazon, Apple, Chevron, Snap, Booking, Clorox, Atlassian, and More",2024-08-02
Apple stock finishes flat following Q3 earnings despite a decline in iPhone sales,2024-08-02
Apple stock finish flat following Q3 earnings despite a decline in iPhone sales,2024-08-02
Nasdaq 100 Is in Correction Territory With AI Darlings Sinking,2024-08-02
"Dow Jones, Other Indexes Close Off Lows But Badly Damaged (Live Coverage)",2024-08-02
Stock Market Today: Nasdaq closes in correction territory as recession fears bite,2024-08-02
Google pulls Olympics ad that showed AI writing a little girls letter for her,2024-08-02
"These Stocks Are Moving the Most Today: Intel, Amazon, Apple, Chevron, Snap, Booking, Clorox, Atlassian, and More",2024-08-02
"Magnificent Seven Stocks: Nvidia Stock, Tesla Dive; Amazon Plunges On Earnings",2024-08-02
"Dow Maintains 800-Point Loss, Nasdaq Hit Hardest Of Big Three Indexes (Live Coverage)",2024-08-02
"Apple's Multi-Year iPhone Upgrade Cycle and AI Features To Drive Upside, Analysts Say",2024-08-02
"Midday movers: Unemployment, earnings crush Amazon and Intel; Apple, DoorDash up",2024-08-02
Apple Earnings Lifted the Stock. Why One Analyst Got More Bearish.,2024-08-02
"Top Stock Movers Now: Amazon, Intel, Snap, and More",2024-08-02
"Apple is ignoring generative AI craze, says Needham's Laura Martin",2024-08-02
Warren Buffett Says Steve Jobs Once Called Him Asking How To Invest Apple's Cash Pile  But Ignored His Advice And Did Nothing Instead,2024-08-02
"Stock Market Takes Bearish Turn; Apple, Microsoft, Meta, Amazon, AMD In Focus: Weekly Review",2024-08-02
"Dow Loses 800 Points, Nasdaq Hit Hard As Market Sinks (Live Coverage)",2024-08-02
Wedbush's Dan Ives on big tech: Hard to be bearish on Apple in 'AI-driven super cycle',2024-08-02
"Dow Jones, Nasdaq Plunge As Jobs Report Adds To Investor Worries; Amazon Tumbles (Live Coverage)",2024-08-02
Q3 2024 Apple Inc Earnings Call,2024-08-02
How Apple Earnings Made Its Stock the Safe Play in Tech,2024-08-02
Bernstein's Toni Sacconaghi breaks down Apple's Q3 results,2024-08-02
Intel CEO: We are going through our biggest restructuring in 40 years,2024-08-02
Dan Niles on why Apple is his top 'Magnificent 7' pick: It's performed the worst over last 3 years,2024-08-02
Apple earnings results keep 'bull thesis alive and well': Analyst,2024-08-02
"July jobs report, Apple earnings, Amazon & Intel fall: 3 Things",2024-08-02
These 5 Dividend Stocks Account for 74% of Warren Buffett's $399 Billion Portfolio,2024-08-02
"Apple, Amazon and Intel earnings recap - what you need to know",2024-08-02
5 Things to Know Before the Stock Market Opens,2024-08-02
"Intel, Amazon, Nvidia, Snap fell premarket; Apple, Exxon rise",2024-08-02
"Futures tumble on July jobs report, Amazon and Intel reports: Yahoo Finance",2024-08-02
Apple Just Sent a Major Warning to Nvidia Investors,2024-08-02
"Fed, Intel, Apple All Updated This Week. Whats Driving the Market Selloff.",2024-08-02
Big Tech's AI spend is becoming too big to fail: Morning Brief,2024-08-02
Apple Stock Edges Down as Big Tech Suffers,2024-08-02
Apple Sees Boost From AI Features After Uneven Third Quarter,2024-08-02
Apple Q3 results beats estimates as services growth offsets softer iPhone sales,2024-08-02
