article,date
Made By Google Event Leads Jefferies To Call Alphabet 'Top Pick' for Consumer AI,2024-08-14
"Magnificent Seven Stocks: Nvidia Stock Rallies; Tesla, Google Sell Off",2024-08-14
"Apple opens up NFC transactions to developers, but says there will be 'associated fees'",2024-08-14
Heard on the Street: Google Stock Slumps as Breakup Worries Spoil Phone Party,2024-08-14
Apple finally allows Spotify to show pricing info to EU users on iOS,2024-08-14
"Mairs and Power Amplifies Apple Stake in Q2 2024, Signaling Strategic Portfolio Adjustments",2024-08-14
Thoughts on the U.S. v. Google Verdict (Part 2),2024-08-14
Heard on the Street: Googles Phone Party Spoiled by Breakup Worries,2024-08-14
'Sheriff of Silicon Valley': How Kamala Harris's tenure as California AG could shape her approach to Big Tech,2024-08-14
Could the US Government Break Up Google After Monopoly Ruling?,2024-08-14
Warren Buffett Stocks: What's Inside Berkshire Hathaway's Portfolio?,2024-08-14
Tencent Says in Talks With Apple About Mini Games Mobile Revenue,2024-08-14
Prediction: Buffett's Decision to Offload Apple and Bank of America Stock Could Pay Off In Spades. Here's Why.,2024-08-14
"Starbucks CEO Faces a Cooling Economy, Value Shoppers. Why the Task Ahead Is Tough, And 5 Other Things to Know Today.",2024-08-14
Spotify to add price information in its app on Apple devices in EU,2024-08-14
Googles New Phones Arent Really About the Phones,2024-08-14
IPhone Maker Hon Hai Sees Sales Rising as AI Nudges Profit Up,2024-08-14
Apple continues developing affordable versions of Vision Pro and AR glasses amid mixed reception,2024-08-14
Apple Stock (NASDAQ:AAPL): 5 Bullish Signs and 1 Red Flag,2024-08-13
4 Takeaways From Alphabet's 'Made By Google' Launch Event,2024-08-13
Mag 7 Insiders Arent Buying Stock Dips,2024-08-13
Google rolls out Pixel 9 phones earlier than usual as AI race with Apple heats up,2024-08-13
"Paramount to shutter TV studio, begins layoffs in cost-cutting frenzy",2024-08-13
"Google Launches Pixel 9 Phones, Pixel Watch 3 in Renewed Push to Sell AI",2024-08-13
"Google Unveils Gemini AI Assistant, Pixel 9 Phones. Takes Aim At Apple IPhone 16 Launch.",2024-08-13
"Apple, Intel, And AMD Lead Charge In AI-Capable PC Market Surge: Report",2024-08-13
"With volatility ahead, invest in the Mag 7: Portfolio manager",2024-08-13
Google unveils new phones and other gadgets powered by AI,2024-08-13
"Google debuts Pixel smartphone lineup, including a new foldable phone, ahead of Apple's latest iPhone push",2024-08-13
Google To Take Wraps Off AI-Ready Pixel 9 Phones Ahead Of IPhone 16 Launch,2024-08-13
Googles Pixel Smartphone Event Is Here. What It Means for Alphabet Stock.,2024-08-13
Thoughts on the U.S. v. Google Verdict (Part 1),2024-08-13
Indian regulator orders recall of Apple antitrust investigation,2024-08-13
"AI PCs made up 14% of quarterly personal computer shipments, Canalys says",2024-08-13
Traders Hope Alphabets Pixel Event Can Stem $360 Billion Rout,2024-08-13
Jeremy Grantham's Strategic Moves in Q2 2024: A Closer Look at Apple Inc's Impact,2024-08-13
"Got $3,000? 3 Artificial Intelligence (AI) Stocks to Buy and Hold for the Long Term",2024-08-13
Samsungs AI Phone Boost Might Be Fading. Whats in Store for Apple.,2024-08-13
5 Things to Know Before the Stock Market Opens,2024-08-13
ExecThread Ranks No. 524 on the Inc. 5000 List of America's Fastest Growing Companies,2024-08-13
India Watchdog to Retract Report Alleging Apple Market Abuse,2024-08-13
"Here's the ""Magnificent Seven"" Stock I'm Loading Up On During the Current Market Sell-Off",2024-08-13
Apple Inc (AAPL): A Detailed Analysis of Its Market Position and Growth Potential in the Computer Hardware Sector,2024-08-13
"1 Unstoppable Stock Set to Join Nvidia, Apple, Microsoft, Amazon, Alphabet, and Meta in the $1 Trillion Club",2024-08-13
"Warren Buffett may have heeded this sell signal on Apple stock: While market cap quadrupled, profits only doubled",2024-08-13
Are Magnificent 7 valuations attractive again?,2024-08-12
What Broke and What Got Stronger Amid the Market's Summer Storm,2024-08-12
Apple says Patreon must switch to its billing system or risk removal from App Store,2024-08-12
Patreon Says It Must Use Apples Payment System Or Risk Removal,2024-08-12
What To Expect From Google's Launch Event Tuesday,2024-08-12
Wolfe Research downgrades Qualcomm over Apple's chip plans,2024-08-12
Google Looks to Get Jump on Apple With Earlier Pixel Launch,2024-08-12
Qualcomm Stock Faces Apple Risk. One Bull Is Gone.,2024-08-12
Non-Mag 7 equities are a 'once in a generation opportunity',2024-08-12
The Best Costco Finds This Week,2024-08-12
Magnificent Seven Stocks: Nvidia Stock Rallies; Tesla Slides,2024-08-12
"Apple Stock Faces Buffett, Google Headwinds. Why the iPhone Matters More.",2024-08-12
"AI Could Help the iPhone 16 Drive an Apple Renaissance, Wedbush Says",2024-08-12
Jim Cramer on Apple Inc. (AAPL): The Usual Suspect of The Magnificent 7,2024-08-12
Is Qualcomm a Millionaire-Maker Stock?,2024-08-12
5 Things to Know Before the Stock Market Opens,2024-08-12
Wedbush: This iPhone upgrade cycle could set stage for Apple supercycle,2024-08-12
Watch These XLK Tech Sector ETF Price Levels Amid Recent Volatility,2024-08-11
OLED iPad supply chain shift: LGD expands as SDC rumored to scale back,2024-08-11
QUALCOMM Incorporated (QCOM): Among Morgan Stanley's Top Humanoid Robot Stock Picks,2024-08-11
STMicroelectronics N.V. (STM): Morgan Stanley is Bullish on This Humanoid Robot Stock Now,2024-08-11
Should Apple Acquire Peloton in 2024? 2 Things Investors Need to Know.,2024-08-11
Apple Fans are likely to see Meaningful upgrades coming to Apple's 2025 iPhone Lineup,2024-08-11
Warren Buffett Declares Shift: Selling Apple Stock To Invest In This 'Magnificent' Megacap  Here's Why,2024-08-11
Should You Buy Alphabet Stock Following Its Antitrust Defeat? 3 Tech Watchers Weigh In.,2024-08-11
Warren Buffett Just Trimmed His Apple Stock. Should You?,2024-08-11
"Nvidia Is Dominating the Artificial Intelligence Chip Market, but Apple Has Been Securing Supply From Another Tech Giant",2024-08-11
"Should You Invest in ETFs or Just Own Shares of Nvidia, Apple, and Microsoft?",2024-08-11
"Foxconn adds 50,000 workers in Zhengzhou plant as it prepares for Apple's iPhone 16 launch",2024-08-11
Apple Inc. (AAPL): Warren Buffett and Hedge Funds Are Crazy About This Stock Now,2024-08-11
"Prediction: 1 Unstoppable Stock Could Join Microsoft, Apple, Nvidia, Alphabet, Amazon, and Meta in the $1 Trillion Club by 2034",2024-08-11
Warren Buffetts sale of 510 million Apple shares will go down as one of the best bets of his career,2024-08-11
Prediction: 3 Stocks That'll Be Worth More Than Amazon 10 Years From Now,2024-08-11
15 Smartphone Companies with the Largest Market Share in 2024,2024-08-10
"Amazon.com, Inc. (AMZN): Are Street Analysts Bullish on This AI Stock Now?",2024-08-10
Microsoft Corporation (MSFT): The Best AI Stock According to Financial Media?,2024-08-10
"Is Meta Platforms, Inc. (META) the Best AI Stock to Buy According to Hedge Funds?",2024-08-10
Warren Buffett Just Sold Half of His Apple Stock. 3 Reasons Not to Panic.,2024-08-10
"Is Intuitive Surgical, Inc. (ISRG) a Good Artificial Intelligence Stock to Buy Now?",2024-08-10
Apple Gets Caught Up in Market Sell-Off. Is It Time to Buy the Dip in the Stock?,2024-08-10
10 Best Artificial Intelligence (AI) Stocks To Buy According to Financial Media,2024-08-10
20 Industrial Stocks Already Riding the AI Wave,2024-08-10
Warren Buffett Just Sent a $277 Billion Warning to Stock Investors,2024-08-10
Apple Says No to Nvidia GPUs. Is This the End for Nvidia?,2024-08-10
2 Stocks to Buy In a Stock Market Sell-Off,2024-08-10
"AAPL Stock Outlook: While Apple's AI Plans Are Promising, Wait for a Better Entry Point",2024-08-10
Stock-Split Watch: 2 AI Stocks That Look Ready to Split,2024-08-10
EchoStar Corporation (NASDAQ:SATS) Q2 2024 Earnings Call Transcript,2024-08-10
3 Stocks to Pounce on as Consumer Confidence Rises,2024-08-10
Intel is the latest Fortune 500 giant to test the 4 wrong CEOs rule,2024-08-10
Prediction: These Will Be Warren Buffett's Top-5 Stocks in 2025,2024-08-10
Prediction: This Stock Will Be Warren Buffett's Top Performer by 2030,2024-08-10
"The Score: Apple, Walt Disney, Eli Lilly and More Stocks That Defined the Week",2024-08-09
Warren Buffett Just Cut Half of Berkshire Hathaway's Stake in Apple. Why?,2024-08-09
"Volatile week for stocks, where investors are buying: Catalysts",2024-08-09
Apple changes app store policy after EU Commission findings,2024-08-09
Apple reportedly has a new Mac Mini: 3 thing you need to know,2024-08-09
3 stocks retail investors turned to when stocks fell this week,2024-08-09
"Google Has Been Ruled a Monopoly. On the Internet, It May Not Matter.",2024-08-09
"Apple 3Q24 10-Q Takeaways, A Few Interesting Tidbits About Apple's Share Buyback, Apple's Free Cash Flow Margin",2024-08-09
Strategist: Why Meta looks like the 'Magnificent 7' standout right now,2024-08-09
Heres this strategists top 'Magnificent 7' stock to buy after the rout,2024-08-09
"Apple Defies Tech Sell-Off With Strong Earnings, AI Momentum",2024-08-09
Buffetts Apple Share Dump Is Set to Reshape Major Stock Gauges,2024-08-09
"Spotify and Epic Games call Apple's revised DMA compliance plan 'confusing,' 'illegal' and 'unacceptable'",2024-08-09
"TSMC July Sales Jump 45%, Buoyed by Strong AI Chip Demand",2024-08-09
5 Things to Know Before the Stock Market Opens,2024-08-09
"These Were the 5 Biggest Companies in 2014, and Here Are the 5 Biggest Companies Now",2024-08-09
3 Warren Buffett Stocks to Buy During the Stock Market Sell-Off Without Any Hesitation,2024-08-09
"1 Unstoppable Stock That Could Join Apple, Microsoft, Nvidia, Alphabet, Amazon, and Meta in the $1 Trillion Club",2024-08-09
ByteDance Is Said to Seek Refinancing of $5 Billion Loan,2024-08-08
Google's antitrust case loss affects Apple; may accelerate expansion of AI search market,2024-08-08
A Crackdown Is Coming for People Hanging On to Student Discounts,2024-08-08
Apple's AI playbook,2024-08-08
"Apple revises DMA compliance for App Store link-outs, applying fewer restrictions and a new fee structure",2024-08-08
Apple could charge up to $20 for Apple Intelligence features,2024-08-08
Apple changes EU app store policy after Commission probe,2024-08-08
"Midday movers: Eli Lilly, Robinhood and Zillow rise; Warner Bros, Fastly, Bumble fall",2024-08-08
"Apple's Satellite Connectivity Provider Globalstar's Q2 Revenue Grows 10% On Wholesale Capacity Surge, Hikes FY24 Outlook",2024-08-08
47 Apple patent applications were published today covering a Native Apple AI Network Architecture and more,2024-08-08
"Magnificent Seven Stocks: Nvidia Stock, Tesla Rally; Meta Retakes Key Level",2024-08-08
"In 2021, Charlie Munger Told Warren Buffett It Was A Mistake To Sell Apple Shares. Will He Be Right Again?",2024-08-08
Warren Buffett's Berkshire Hathaway Just Dumped Half Its Stake in Apple Stock. What Investors Need to Know,2024-08-08
"Eli Lilly, Robinhood and Zillow rose premarket; Warner Bros, Fastly, Bumble fall",2024-08-08
Did You Catch the Good News From PayPal?,2024-08-08
Top investor's best 'Magnificent 7' stock to buy right now,2024-08-08
1 Growth Stock Down 6% to Buy Right Now,2024-08-08
This Incredibly Cheap Artificial Intelligence (AI) Stock Could Be About to Go on a Bull Run,2024-08-08
These Analysts Think Apple (AAPL) is Still One of the Best AI Stocks to Buy Now,2024-08-08
Prediction: This Hypergrowth Company Will Be Wall Street's First $6 Trillion Stock -- and It's Not Nvidia!,2024-08-08
"US futures, jobless claims, Apple - what's moving markets",2024-08-08
Think You Know Apple? Here's 1 Little-Known Fact You Can't Overlook.,2024-08-08
Expanding the Cloud for AI,2024-08-08
Indian Motherson reportedly to form JV with BIEL in supplying iPhone glasses,2024-08-07
"Apple Original Films has already tapped writer, director and producer Jon Watts to write a sequel to 'Wolfs' that is set to debut in September",2024-08-07
"The Carry Trade, the Nikkei, and Your Portfolio",2024-08-07
Apple's Chinese Tablet Competitor Huawei has released a new 12.2' Pro model with a High End OLED Display at an affordable price,2024-08-07
Apple Is the Big Loser in Googles Antitrust Battle,2024-08-07
"Google Antitrust Ruling Is a Negative for Its Credit and Apples, Moodys Says",2024-08-07
"MSFT, GOOGL, META, AMZN, AAPL: Big Techs Big Spend on AI",2024-08-07
Why you may want to wait to buy a new iPhone,2024-08-07
"Google Has Been Ruled a Monopoly. On the Internet, It May Not Matter.",2024-08-07
Big Tech is in 'penalty box' for now: Barclays strategist,2024-08-07
Some European users will get access to Apple Intelligence after all,2024-08-07
Apple could lose $20bn in Google search antitrust ruling,2024-08-07
Best Stock to Buy Right Now: Amazon vs. Apple,2024-08-07
Jim Cramer: Market Will Never Give Apple Inc (AAPL) Benefit of the Doubt,2024-08-07
Warren Buffett Just Sold $90 Billion of Apple Stock. Could This Be the Biggest Investing Mistake He's Ever Made?,2024-08-07
"Nasdaq Market Correction: 1 ""Magnificent Seven"" Stock to Buy Now, and Another to Avoid",2024-08-07
India antitrust watchdog reportedly finds Apple abusing market dominance,2024-08-06
"Recession outlook, tech trade, Zoetis CFO: Market Domination",2024-08-06
Googles unlawful grip on search could shatter its market dominance,2024-08-06
"A judge has branded Google a monopolist, but AI may bring about quicker change in internet search",2024-08-06
A Microsoft victory and Mozilla defeat: The fallout from Googles antitrust saga,2024-08-06
Apple Intelligence's writing tools stumble on swears and controversial topics,2024-08-06
Google Says It Will Appeal Antitrust Ruling What That Could Mean for Big Tech,2024-08-06
"Made by Google 2024: Pixel 9, Gemini, a new foldable and other things to expect from the event",2024-08-06
"These Stocks Moved the Most Today: Palantir, Nvidia, Uber, Caterpillar, CrowdStrike, Lumen, Kenvue, ZoomInfo, and More",2024-08-06
"Big Tech stocks: It's time to go bargain hunting, analyst says",2024-08-06
Google antitrust ruling may pose $20 billion risk for Apple,2024-08-06
Analysts review Apple stock price hit from Google antitrust ruling,2024-08-06
Trade Tracker: Kevin Simpson buys American Express and more Apple,2024-08-06
"These Stocks Are Moving the Most Today: Palantir, Nvidia, Uber, Caterpillar, CrowdStrike, Lumen, Kenvue, ZoomInfo, and More",2024-08-06
"Markets eye rebound, Google loses antitrust suit: Catalysts",2024-08-06
"If You'd Invested $5,000 in Apple Stock 5 Years Ago, Here's How Much You'd Have Today",2024-08-06
Google monopoly ruling could help Apple defense in antitrust case,2024-08-06
Heard on the Street: Googles Loss Doesnt Have Wall Street Worried Yet,2024-08-06
Tech had a rough day. But dont call it a dot-com meltdown moment yet,2024-08-06
"We know the Google antitrust ruling is huge, but we dont know what it really means yet",2024-08-06
Google search antitrust ruling could hurt iPhone maker Apple,2024-08-06
Breaking up Google would offer a chance to remodel the web,2024-08-06
"Buffett Slashes AAPL Stake in Half, What's Really Going On?, Removing the Buffett Overhang",2024-08-06
Wall Street sees 'buying opportunity' amid AI pullback,2024-08-06
"Apple Stock Slips, Microsoft Gains. What Googles Antitrust Loss Means for Big Tech.",2024-08-06
Big Tech Traders Struggle to Find Reasons to Buy This Dip,2024-08-06
Google and Apple Can Afford to Play Long Game After Antitrust Ruling,2024-08-06
"Are the AI, tech trades still the move after Mag 7 losses?",2024-08-06
Bearish Trade On Apple Could Return 23% In Less Than 7 Weeks,2024-08-06
"These Stocks Are Moving the Most Today: Palantir, Nvidia, Uber, Caterpillar, CrowdStrike, Apple, Lumen, Lucid, ZoomInfo, and More",2024-08-06
"Don't see AI having a big impact on Apple this year or next, says LightShed Partners' Walter Piecyk",2024-08-06
Warren Buffett Leaves 4 Investors Holding The Bag On Apple Stock,2024-08-06
"Apple Stock Slips, Microsoft Gains. What Googles Antitrust Loss Means for Big Tech.",2024-08-06
Google Loses Antitrust Case. Judge Says Its a Monopolist.,2024-08-06
Big Tech Traders Struggle to Find Reasons to Buy This Dip,2024-08-06
Is It Too Late to Buy Apple Stock?,2024-08-06
Warren Buffett Is Selling Apple Stock and Buying This Magnificent Megacap Stock Instead,2024-08-06
Berkshire Hathaway Stock (NYSE:BRK.B): Dont Panic Following Halving of Apple Stake,2024-08-06
"Berkshire's selling of Apple was 'risk management' decision, says Glenview's Bill Stone",2024-08-05
"Apple, Nvidia lead big tech selloff",2024-08-05
AI gamble looms large as Apple seeks to revive iPhone sales in China,2024-08-05
"Forget Apple, the biggest loser in the Google search ruling could be Mozilla and its Firefox web browser",2024-08-05
"Nvidia, Microsoft, and Apple Could Help This Stock-Split ETF Turn $400 per Month Into $1 Million",2024-08-05
How an Investing Strategy in Japan Spurred a Global Market Rout,2024-08-05
Apples Shift to AI Is Poised to Soften Blow From Google Ruling,2024-08-05
"Google Broke Antitrust Law With Search Monopoly, Federal Judge Rules",2024-08-05
Google's antitrust loss could put billions at risk for Apple,2024-08-05
"Google's search monopoly, El-Erian talks the Fed: Market Domination",2024-08-05
'Magnificent Seven' Losses Approach $3 Trillion Amid Weeks-Long Selloff,2024-08-05
Magnificent Seven stocks shed over $600 billion during selloffNvidia hit hardest,2024-08-05
"Berkshire was too concentrated in Apple, says NYU's Aswath Damodaran",2024-08-05
Apple Has a Terrible Day as Big Tech Gets Slammed,2024-08-05
Market Meltdown: Is This 1999 All Over Again?,2024-08-05
Bets on emergency US rate cut ramp up as recession fears grow,2024-08-05
Federal Judge Rules Against Google In Antitrust Case. Will Apple Deal Be Impacted?,2024-08-05
S&P 500 Is Pummeled in Worst Day Since 2022 as Tech Stocks Dive,2024-08-05
"Nvidia, Apple stocks drop as tech sector tumbles",2024-08-05
All eyes are on the future of the tech trade during sell-off,2024-08-05
Apple Stock Slides After Warren Buffett's Berkshire Hathaway Cuts Stake,2024-08-05
Google loses antitrust trial in major blow to tech giant,2024-08-05
"These Stocks Are Moving the Most Today: Nvidia, Super Micro, Apple, Intel, Palantir, Amazon, and More",2024-08-05
"Magnificent Seven Stocks Roiled: Nvidia Plunges On AI Chip Delay; Apple, Tesla Dive",2024-08-05
Berkshire Hathaway cuts Apple position: Here's what you should know,2024-08-05
Warren Buffetts stock empire loses $15bn in global market crash,2024-08-05
"Apple, Krystal Biotech fall; Tyson Foods, Kellanova rise, Monday, 8/5/2024",2024-08-05
Why Apple Stock Got Crushed on Monday,2024-08-05
"Top Stock Movers Now: Nvidia, Apple, Kellanova, and More",2024-08-05
These Stocks Are Moving the Most Today,2024-08-05
"Magnificent Seven Stocks Roiled: Nvidia Plunges On AI Chip Delay; Apple, Tesla Dive",2024-08-05
Apple Stock Falls Amid Broad Selloff as Berkshire Hathaway Trims Stake Again,2024-08-05
"Apple Joins The Increased AI Spending Trend But As Always, With A Unique Take",2024-08-05
S&P 500 Is on Track for Worst Day Since 2022 as Tech Stocks Dive,2024-08-05
The two tech stocks to buy despite major sector sell-off,2024-08-05
"Midday movers: Apple, Nvidia, Intel, Coinbase and Moderna fall",2024-08-05
"Warren Buffett's moves on Apple 'make a lot of sense' to me right now, says Maxim Group's Tom Forte",2024-08-05
Why this market pullback may be good for Big Tech,2024-08-05
Warren Buffett Stocks: What's Inside Berkshire Hathaway's Portfolio?,2024-08-05
"Stocks to Watch Monday: Kellanova, Nvidia, Apple, Tesla",2024-08-05
Apple Stock Leads Big Tech Drop. Worries About an AI Bubble Are Back.,2024-08-05
"Im skipping the iPhone 16 compelling upgrade cycle  and refusing to give up my battered iPhone 12. Sorry, Apple.",2024-08-05
Heres Why Bulls are Wrong About Apple (AAPL)  And Probably Why Warren Buffett is Dumping the Stock,2024-08-05
Warren Buffett's Berkshire Hathaway slashes Apple stake,2024-08-05
Why Apple (AAPL) International Revenue Trends Deserve Your Attention,2024-08-05
"Market sell-off, tech takes hit, bitcoin falls: 3 Things",2024-08-05
"Amazon, Microsoft, Alphabet Spent More on AI than Expected. This Is What It Did to the Stocks.",2024-08-05
"These Stocks Are Moving the Most Today: Nvidia, Super Micro, Apple, Intel, Kellanova, Palantir, Coinbase, AMC, and More",2024-08-05
"Magnificent Seven set to shed $1 trillion in value, led by Apple, Nvidia",2024-08-05
Is Apple Stock A Buy Or Sell As Warren Buffett Slashes Stake?,2024-08-05
Navigating Market Uncertainty: Intrinsic Value of Apple Inc,2024-08-05
"Now not the time to panic on the tech trade, bargain hunt after selloff: Wedbush",2024-08-05
DSA vs. DMA: How Europe's twin digital regulations are hitting Big Tech,2024-08-05
5 Things to Know Before the Stock Market Opens,2024-08-05
Apple shares plunge after Berkshire cuts stake,2024-08-05
"Nvidia, Microsoft, or Apple: Which $3 Trillion-Dollar Stock Is the Better Artificial Intelligence (AI) Play?",2024-08-05
Warren Buffett's Selling Over $3.8 Billion Worth of Bank of America Stock in 2 Weeks Is an Ominous and Unmistakable Warning for Wall Street,2024-08-05
Apple Could Help Add These 2 Unstoppable Stocks to the $1 Trillion Club,2024-08-05
Huawei reportedly to introduce shared memory for next PC chip,2024-08-05
Apple Supplier Stocks Slump After Berkshire Nearly Halves Stake,2024-08-05
Apple faces tough road ahead in China despite growing revenue,2024-08-04
What Buffett's huge Apple sale really means,2024-08-04
"Buffett's Berkshire cuts Apple stake by half, boosts cash stockpile to $277B as it gets 'defensive",2024-08-04
Is Nvidia Stock a Buy Now?,2024-08-04
'Warren Crushed Apple' Says Jim Cramer As Buffett Cuts Stake In Tech Giant By Nearly Half: Here's How Much Dividend Income Berkshire Forgoes,2024-08-04
Berkshire Hathaway sold half of its Apple stock,2024-08-04
These 2 Dow Stocks Are Set to Soar in 2024 and Beyond,2024-08-04
Apple Investors Urged to Stay Calm After Buffett Slashes Stake,2024-08-04
Samsung's executive chairman Lee Jae-yong's disapproval of the company designers copying the Apple Watch Ultra is incredulous,2024-08-04
72% of Warren Buffett's Berkshire Hathaway Portfolio Is Invested in These 5 Dividend Stocks,2024-08-04
Buffett a 'core believer' in Apple - Wedbush,2024-08-04
"OpenAI Is Launching a Search Engine, but Don't Sell Your Alphabet (Google) Stock Just Yet",2024-08-04
"1 Unstoppable Stock That Could Join Apple, Microsoft, Nvidia, Alphabet, Amazon, and Meta in the $1 Trillion Club",2024-08-03
"Apple, E-Commerce Giant Lead Five Stocks Near Buy Points",2024-08-03
Key Takeaways From Berkshire Hathaway's Earnings,2024-08-03
Warren Buffetts Berkshire Hathaway Slashes Apple Stake,2024-08-03
Warning: Warren Buffett is selling stocks. A lot,2024-08-03
Warren Buffett's Berkshire sold nearly half of its Apple stake,2024-08-03
Berkshire Hathaway Slashes Apple Stake by Nearly 50%,2024-08-03
Is Apple Stock a Buy?,2024-08-03
What We Learned From Big Tech Earnings in the Past Week,2024-08-03
Apple Just Exposed a Massive Risk for Nvidia Stock,2024-08-03
Warren Buffett Doesn't Understand Artificial Intelligence (AI). But It Could Soon Make Him a Boatload of Money.,2024-08-03
"Prediction: 2 Growth Stocks (Under $100 Billion) Will Join Nvidia, Apple, and Microsoft as $1 Trillion Companies by 2040",2024-08-03
Intel needs 'a lot of things' to play in their favor in restructuring bid: Analyst,2024-08-02
"Apple's 3Q24 Earnings, The iPhone Is a Powder Keg",2024-08-02
"The Score: CrowdStrike, Apple, Intel and More Stocks That Defined the Week",2024-08-02
"These Stocks Moved the Most Today: Intel, Amazon, Apple, Chevron, Snap, Booking, Clorox, Atlassian, and More",2024-08-02
Apple stock finishes flat following Q3 earnings despite a decline in iPhone sales,2024-08-02
Apple stock finish flat following Q3 earnings despite a decline in iPhone sales,2024-08-02
Nasdaq 100 Is in Correction Territory With AI Darlings Sinking,2024-08-02
"Dow Jones, Other Indexes Close Off Lows But Badly Damaged (Live Coverage)",2024-08-02
Stock Market Today: Nasdaq closes in correction territory as recession fears bite,2024-08-02
Google pulls Olympics ad that showed AI writing a little girls letter for her,2024-08-02
"These Stocks Are Moving the Most Today: Intel, Amazon, Apple, Chevron, Snap, Booking, Clorox, Atlassian, and More",2024-08-02
"Magnificent Seven Stocks: Nvidia Stock, Tesla Dive; Amazon Plunges On Earnings",2024-08-02
"Dow Maintains 800-Point Loss, Nasdaq Hit Hardest Of Big Three Indexes (Live Coverage)",2024-08-02
"Apple's Multi-Year iPhone Upgrade Cycle and AI Features To Drive Upside, Analysts Say",2024-08-02
"Midday movers: Unemployment, earnings crush Amazon and Intel; Apple, DoorDash up",2024-08-02
Apple Earnings Lifted the Stock. Why One Analyst Got More Bearish.,2024-08-02
"Top Stock Movers Now: Amazon, Intel, Snap, and More",2024-08-02
"Apple is ignoring generative AI craze, says Needham's Laura Martin",2024-08-02
Warren Buffett Says Steve Jobs Once Called Him Asking How To Invest Apple's Cash Pile  But Ignored His Advice And Did Nothing Instead,2024-08-02
"Stock Market Takes Bearish Turn; Apple, Microsoft, Meta, Amazon, AMD In Focus: Weekly Review",2024-08-02
"Dow Loses 800 Points, Nasdaq Hit Hard As Market Sinks (Live Coverage)",2024-08-02
Wedbush's Dan Ives on big tech: Hard to be bearish on Apple in 'AI-driven super cycle',2024-08-02
"Dow Jones, Nasdaq Plunge As Jobs Report Adds To Investor Worries; Amazon Tumbles (Live Coverage)",2024-08-02
Q3 2024 Apple Inc Earnings Call,2024-08-02
How Apple Earnings Made Its Stock the Safe Play in Tech,2024-08-02
Bernstein's Toni Sacconaghi breaks down Apple's Q3 results,2024-08-02
Intel CEO: We are going through our biggest restructuring in 40 years,2024-08-02
Dan Niles on why Apple is his top 'Magnificent 7' pick: It's performed the worst over last 3 years,2024-08-02
