article,date
Apple earnings results keep 'bull thesis alive and well': Analyst,2024-08-02
"July jobs report, Apple earnings, Amazon & Intel fall: 3 Things",2024-08-02
These 5 Dividend Stocks Account for 74% of Warren Buffett's $399 Billion Portfolio,2024-08-02
"Apple, Amazon and Intel earnings recap - what you need to know",2024-08-02
5 Things to Know Before the Stock Market Opens,2024-08-02
"Intel, Amazon, Nvidia, Snap fell premarket; Apple, Exxon rise",2024-08-02
"Futures tumble on July jobs report, Amazon and Intel reports: Yahoo Finance",2024-08-02
Apple Just Sent a Major Warning to Nvidia Investors,2024-08-02
"Fed, Intel, Apple All Updated This Week. Whats Driving the Market Selloff.",2024-08-02
Big Tech's AI spend is becoming too big to fail: Morning Brief,2024-08-02
Apple Stock Edges Down as Big Tech Suffers,2024-08-02
Apple Sees Boost From AI Features After Uneven Third Quarter,2024-08-02
Apple Q3 results beats estimates as services growth offsets softer iPhone sales,2024-08-02
