article,date
"Electric Car Wars: Who Will Win The Battle For The $30,000 EV?",2024-08-08
"Magnificent Seven Stocks: Nvidia Stock, Tesla Rally; Meta Retakes Key Level",2024-08-08
Tough Summer for US Stocks Overshadows Estimate-Beating Earnings,2024-08-08
Tesla Stock Is Up. Heres Where Its Headed.,2024-08-08
Tesla Stock Is Slipping. Heres the Reason Its Moving.,2024-08-08
Sunrun partners with Tesla for virtual power plant in Texas,2024-08-08
20 Most Comfortable Cars of 2024,2024-08-07
"Tesla: FSD price cuts could be critical catalyst for shares, RBC says",2024-08-07
Tesla Stock (NASDAQ:TSLA): Heres Its Secret Growth Machine,2024-08-07
"Abandoned Acquisitions, AI, and Robotaxis...Big Things in the World of Stocks",2024-08-07
Tesla's energy business expands with Sunrun partnership in Texas,2024-08-07
Tesla CEO Elon Musk Deserves His $60 Billion Pay Package. This Analysis Backs It Up.,2024-08-07
US auto safety agency seeks information from Tesla on fatal Cybertruck crash and fire in Texas,2024-08-07
Big Tech is in 'penalty box' for now: Barclays strategist,2024-08-07
Tesla Stock Is Falling. Ubers Self-Driving News Didnt Help.,2024-08-07
Tesla Stock Ended Higher. It Was All About Japan.,2024-08-07
Sunrun Stock Surges After Surprise Profit. The Solar Panel Installer Teams Up With Tesla.,2024-08-07
Why this Tesla investor and Elon Musk supporter is buying the stock dip,2024-08-07
A black swan market crash on the horizon?,2024-08-07
Tesla Stock Is Rising. Heres How Other EV Makers Are Helping.,2024-08-07
Elon Musks backing of Donald Trump is hurting Teslas struggling EV business in Europe,2024-08-07
"This ""Magnificent Seven"" Stock Has Tanked 7% in 2024: Is It Time to Buy the Dip?",2024-08-07
Jim Cramer Says You Can Buy Tesla Inc (NASDAQ:TSLA) Right Here,2024-08-07
"Americans just cant quit their giant, gas-burning trucks",2024-08-07
Tesla Deploys Fix to 1.6 Million Cars in China for Hood Lock,2024-08-07
Tesla Recalling 1.68 Million Cars in China Over Hood Problem,2024-08-07
Tesla is recalling more than 1.6 million cars in China for a remote software fix,2024-08-06
EV Fund Outflows Hit $1.6 Billion as Trump Fears Add to Slowdown,2024-08-06
Sunrun and Tesla Partner to Support Texas Power Grid Using Residential Solar-Plus-Battery Systems,2024-08-06
"Every Time We Drive We Wonder If Is It Going To Break Again,' Says A Cybertruck Owner Prompting Elon Musk To Step In Personally",2024-08-06
Tesla Stock Is Rising. Its All About Japan.,2024-08-06
"A fiery, deadly Tesla Cybertruck crash has caught the Fed's attention",2024-08-06
German drugstore chain shuns Teslas over Musk's support for Trump,2024-08-06
"Stock market turmoil only half complete, warns Wall Street giant",2024-08-06
Elon Musk's X thinks boycotting advertisers are creating a monopoly against it,2024-08-06
"Tesla OTA recall for China, too",2024-08-06
Chinese carmaker beats Tesla in race to put humanoid robots in factories,2024-08-06
Cathie Wood Goes Bargain Hunting: 3 Stocks She Just Bought,2024-08-06
Uber Stock Jumps as Q2 Profits More Than Double,2024-08-06
3 Things You Need to Know if You Buy Tesla Today,2024-08-06
"Are the AI, tech trades still the move after Mag 7 losses?",2024-08-06
"Tesla to fix 1.7 million vehicles in China, says market regulator",2024-08-06
"Schwab Investors Dump Tesla Just In Time, But Keep Loving Nvidia",2024-08-06
Tesla Stock Is Rising. Its All About Japan.,2024-08-06
Why Trump wont crush Tesla and Elon Musk,2024-08-06
"All Musk's Xs move to Texas: Flagship social media company joins SpaceX, Tesla in the Lone Star State",2024-08-05
This Artificial Intelligence (AI) Company Might End Up Being Nvidia's Biggest Competitor (Hint: It's Not AMD),2024-08-05
"Google's search monopoly, El-Erian talks the Fed: Market Domination",2024-08-05
'Magnificent Seven' Losses Approach $3 Trillion Amid Weeks-Long Selloff,2024-08-05
Donald Trump got a Tesla Cybertruck from a controversial influencerright after the former president said EVs will destroy the country,2024-08-05
Nvidia shares tank as 'Magnificent 7' stocks lose more than $650 billion in market cap,2024-08-05
Tesla Stock Is Plunging. Not Even Elon Musks Sales Optimism Can Save It.,2024-08-05
Morgan Stanley survey: Tesla's popularity is waning,2024-08-05
All eyes are on the future of the tech trade during sell-off,2024-08-05
Elon Musk revives feud with OpenAIs Sam Altmanthe Emperor has no clothes,2024-08-05
"TheStreet Auto Week: Analysts evaluate Tesla FSD, mull over Stellantis",2024-08-05
"Elon Musk Files Lawsuit Accusing ChatGPT Maker OpenAI of Deception, Fraud",2024-08-05
US auto safety agency says it is seeking information on fatal Tesla Cybertruck crash,2024-08-05
Magnificent Seven Tech Stocks Shed More Than $700 Billion in Market Value,2024-08-05
Nvidia shares tank as 'Magnificent 7' stocks on track to lose $620 billion in market cap,2024-08-05
"Magnificent Seven Stocks Roiled: Nvidia Plunges On AI Chip Delay; Apple, Tesla Dive",2024-08-05
Why Tesla Stock Is Down Today,2024-08-05
"Tesla Dojo: Elon Musk's big plan to build an AI supercomputer, explained",2024-08-05
An Nvidia rival just landed $640 million in cash   and a Meta AI mentor,2024-08-05
Elon Musk's endorsement is why Trump now likes EVs,2024-08-05
Elon Musk's AI chatbot called out for spreading fake election news,2024-08-05
OTA fix for 1.8m Tesla recall,2024-08-05
"Neuralink has implanted its second patient with a brain chip, Elon Musk says",2024-08-05
Nvidia stock tanks as Magnificent 7 shares see worst market cap loss ever,2024-08-05
"Stocks to Watch Monday: Kellanova, Nvidia, Apple, Tesla",2024-08-05
Magnificent Seven Tech Stocks Shed More Than $700 Billion in Market Value,2024-08-05
Tech ETFs That Drew Billions Are Battered by Losses Hitting 60%,2024-08-05
Nvidia Stock Plummets on Reported Delay of Its New AI Chip Amid Global Sell-Off,2024-08-05
"Tesla, Rivian, Ford and other automaker and EV stocks are sinking as the market panics",2024-08-05
Tesla stock falls as global sell-off hits US markets,2024-08-05
Heres Why Analysts are Bearish on Tesla Inc (NASDAQ:TSLA),2024-08-05
Elon Musk Says Warren Buffett Is 'Clearly Expecting A Correction' After Berkshire Sold Nearly Half Of Its Apple Stock,2024-08-05
I drove Teslas apocalyptic Cybertruck through L.A. to figure out why it exists,2024-08-05
Donald Trump admits EV flip-flop was a quid pro quo to secure Elon Musks support,2024-08-05
FreightWaves Infographics: Tesla Q2 profits plunge over 40% due to growing EV competition,2024-08-05
Why this investor thinks Tesla stock could hit $10K: Opening Bid,2024-08-05
Tesla Stock Is Plunging. Not Even Elon Musks Sales Optimism Can Save It.,2024-08-05
"Forget the ""Magnificent Seven:"" These 3 Tech Stocks Are Table-Pounding Buys",2024-08-05
Taiwan sales rise 8% in July,2024-08-05
You can't buy a Chinese EV in the United States. But they dominate in Southeast Asia,2024-08-05
Former Tesla executive launches Xelerate Ventures to propel AI for Good in Taiwan,2024-08-05
Berkshire Hathaway's Massive $277B Cash Hoard Rekindles Tesla Investment Chatter: Fund Manager Says 'Two Worlds Seldom Collide',2024-08-04
EV costs on track to match gas guzzlers as early as next year as battery prices drop 'dramatically',2024-08-04
Elon Musk Just Told Tesla Investors to Sell Their Shares. Here's Why He Might Be Right.,2024-08-04
2 Reasons to Sell Tesla Stock Right Now (and 1 Reason to Buy),2024-08-04
Tesla Zigs While the Competition Zags: Is the EV Juggernaut a Buy Now?,2024-08-03
"Harris-Buttigieg Could Be Beneficial For Tesla, But Expert Says Elon Musk Still Hopes To 'Have Some Influence' Over Trump To Change His EV Stance",2024-08-03
Tesla Extends Sell-Off; BYD Tumbles Despite Record Sales,2024-08-03
The Top Automotive Industry Trend,2024-08-03
Like Tesla? You'll Love This AI Autonomy Stock,2024-08-03
1 Unfavorable Trend Explains Why Tesla Stock Is Trading 43% Below Its All-Time High,2024-08-03
Musk steps up energy provider plans as Tesla hires operations chief,2024-08-03
What earnings calls have been revealing about consumer weakness,2024-08-02
Tesla attempt to save Elon Musks $56bn pay package gets sceptical reception,2024-08-02
Judge Questions Teslas Argument for Restoring Musks Pay Package,2024-08-02
Why Investors Liked Exxon's Results But Not Chevron's,2024-08-02
"Bug, or bait and switch? Elon Musk's super PAC website isn't working as advertised",2024-08-02
Tesla attorneys ask judge to vacate decision invalidating massive pay package for Elon Musk,2024-08-02
"Magnificent Seven Stocks: Nvidia Stock, Tesla Dive; Amazon Plunges On Earnings",2024-08-02
Tech stocks take a pounding as hedge fund Elliott warns AI trades like Nvidia are in bubble land,2024-08-02
Chevron Says Bye-Bye to California. Tesla Did Too. Who Cares.,2024-08-02
Elon Musk is opening a Montessori school in Texas this fall,2024-08-02
Tesla lawsuit blames 'defective and inadequate' Autopilot for deadly crash,2024-08-02
US oil giant abandons California after 150 years over harsh green policies,2024-08-02
Short-Seller Lefts Deleted Tweets Reappear in Fraud Case,2024-08-02
Teslas Vehicle Shipments From China Factory Jumped in July,2024-08-02
Is Tesla Stock Going to $310? 1 Wall Street Analyst Thinks So.,2024-08-02
Tesla's China-made EV sales rise 15.3% y/y in July,2024-08-02
Ark's Cathie Wood is Buying This Top Artificial Intelligence (AI) Stock Hand Over Fist,2024-08-02
"Tesla registers insurance brokerage in China, national corporate database shows",2024-08-02
Tesla sued by family of motorcyclist killed in Autopilot crash,2024-08-01
Tesla sued an EV charger startup over 'high safety risk',2024-08-01
Chinese EV Deliveries Show Improvement. Its Not Helping Tesla and Other Car Stocks.,2024-08-01
A Tesla that hit and killed a motorcyclist was full-self driving,2024-08-01
"Investing on interest rate cuts, jobless claims, auto loans: Wealth!",2024-08-01
Is now truly a good time to buy an EV? Analyst explains,2024-08-01
"Why Is Tesla, Inc. (TSLA) The Best Stock to Invest In According to Ark Invest?",2024-08-01
Martha Stewart on her stock portfolio: 'I loved Tesla. I'm pissed at Elon Musk',2024-08-01
Tech giants faced major market cap drop in July on earnings worries,2024-08-01
Tesla car that killed motorcyclist was in Full Self-Driving mode,2024-08-01
Option Trade On Tesla Stock Profits In This Sweet Spot,2024-08-01
Inside Volkswagens $130 billion EV battle,2024-08-01
5 Things to Know Before the Stock Market Opens,2024-08-01
"Cathie Wood Thinks This Artificial Intelligence (AI) Stock Can Soar by 1,082%. Here's Why I Think It Could Run Even Higher Than That.",2024-08-01
Rivian Tops Tesla -- and Everyone Else -- in 1 Important Score,2024-08-01
"IS Tesla, Inc. (NASDAQ:TSLA) the Best AI Stock to Buy on the Dip?",2024-08-01
"Tesla car that killed Seattle motorcyclist was in Full Self-Driving mode, police say",2024-07-31
Elon Musk accepts a challenge to fight a Venezuelan strongman: He will chicken out,2024-07-31
US road safety agency will look into fatal crash near Seattle involving Tesla using automated system,2024-07-31
Chinas Robotaxi Dreams Spark Economic Anxiety Over AIs Threat,2024-07-31
Tesla Stock Risesand the Gain Has Nothing to Do With Tesla,2024-07-31
Elon Musk promises not to promote crypto amid surge of social media scams,2024-07-31
Elon Musks xAI considers buying Character.ai- The Information,2024-07-31
Trump says he is against everyone having an electric car,2024-07-31
"Tesla that hit and killed Seattle motorcyclist was in 'Full Self-Driving' mode, police say",2024-07-31
Tesla Stock Is Higher. Heres Whats Driving It.,2024-07-31
Why Tesla Stock Is Bouncing Back Today,2024-07-31
Relief rally in Nvidia cannot hide likelihood stock has entered bear market territory after losing nearly $800 billion,2024-07-31
2nd-Quarter Earnings Growth Is Healthy and Stout,2024-07-31
Mag 7 growth prospects becoming 'very hard to hit',2024-07-31
Uber to deploy Chinese driverless cars,2024-07-31
Elon Musk Says Tesla Now In A Similar Position Nvidia Was In Before Its Stock 'Went Bananas'  Thinks Strong AI Companies Will Dwarf Others,2024-07-31
"Uber, BYD partner to bring EVs to ride-hailing platform globally",2024-07-31
Small caps have nearly caught up to the S&P 500: Morning Brief,2024-07-31
"Xpeng expands autonomous driving system across China, in nation's answer to Tesla's FSD",2024-07-31
Inside the WSJs Investigation of Teslas Autopilot Crash Risks,2024-07-31
"Elon Musk Reaffirms Interest in Bitcoin and Dogecoin, Warns Against Crypto Scams",2024-07-31
"Tesla in Seattle-area crash that killed motorcyclist was using self-driving system, authorities say",2024-07-30
Police say Tesla involved in an April crash that killed a motorcyclist near Seattle was operating on self-driving system,2024-07-30
AI is at an 'important inflection' point: Futurum Group CEO,2024-07-30
"Tesla issues recall, Stellantis announces cost-cutting measures",2024-07-30
Tesla Recalls 1.8 Million Cars. Thats Not Why the Stock Is Dropping.,2024-07-30
Elon Musk said Tesla robotaxi skeptics should try full self driving. A Wall Street analyst nearly crashed,2024-07-30
3 Lithium Stocks That Could Make Your Summer Unforgettable,2024-07-30
