article,date
Jim Cramer Says Piper Sandler Analysts Encourage Investors To Own Shares of Tesla Inc. (TSLA) Ahead Of Its Robitaxi Event,2024-08-21
Inside Gene Wilder's former home that Elon Musk is foreclosing on,2024-08-21
"Magnificent Seven Stocks: Nvidia Stock, Tesla Rally; Meta Eyes Buy Point",2024-08-21
Why Lucid Motors Stock Accelerated Today,2024-08-21
Tesla Cybertrucks are being delivered to customers covered in dirt and full of trash,2024-08-21
"Lucid has 'without a doubt' surpassed Tesla as the EV industry's tech leader, CEO says",2024-08-21
"Step Aside, Tesla. This Stock Wants Your Mag 7 Card.",2024-08-21
8 Stocks to Buy for a Trump Landslideand What to Buy If He Loses,2024-08-21
"As Nvidia recovers, Big Tech has led the way in summer rally",2024-08-21
Xiaomis challenge to Tesla and BYD helps it blow past analyst estimates,2024-08-21
China Targets EU Dairy in Probe as Trade Tensions Intensify,2024-08-21
"Watch Out, Tesla. This Stock Is Ready To Snag Your Mag 7 Card.",2024-08-21
Tesla Stock Is Rising. Its Shrugging Off a Double Whammy of Bad News.,2024-08-21
"Lucid Gravity SUV: We've taken the mantle from Tesla, CEO says",2024-08-21
"Tesla to recall 9,000+ Model X SUVs: NHTSA",2024-08-21
Is Rivian Stock A Buy Or A Sell As The EV Startup Targets Profit Per Vehicle By Q4?,2024-08-21
Is Tesla Stock A Buy Or A Sell As The EU Announces China Vehicle Import Tariffs?,2024-08-21
GM Is Aiming For Electric Pickup Leadership,2024-08-21
China Launches Anti-Subsidy Probe on EU Dairy Imports,2024-08-21
BofAs 15 Stocks for the End of the AI Trade,2024-08-21
5 Things to Know Before the Stock Market Opens,2024-08-21
"Target, Toll Brothers, Keysight rise premarket; Macy's, JD.com, La-Z-Boy fall",2024-08-21
Xiaomi Sales Grow Fastest Since 2021 After EV Sales Kick Off,2024-08-21
"Magnificent Seven Stocks Are Stumbling, Watch This for When to Sell Nvidia and Co. And 5 Other Things to Know Today.",2024-08-21
Ex-Tesla executive hired by Uber,2024-08-21
"Tesla to recall more than 9,000 Model X SUVs, NHTSA says",2024-08-21
Tesla Stock Shrugs Off Double Whammy of Bad News. Heres Whats Happening.,2024-08-21
EU lowers proposed import duties on Chinese BEVs,2024-08-21
"The AI Trade Is Over, BofA Says. What to Buy Instead.",2024-08-21
Inside Elon Musks 23 active lawsuits,2024-08-20
"Tesla Registrations In China Are Still Down, But Demand Looks To Be Stabilizing",2024-08-20
"Uber hires ex-Tesla exec Rebecca Tinucci to oversee EV transition, memo says",2024-08-20
"Tesla Semi battery fire in California rages at 1,000 degrees, spews toxic fumes, shuts down interstate",2024-08-20
Uber Hires Ex-Tesla Charger Executive to Oversee EV Shift,2024-08-20
£1bn wiped off BTs value after Sky strikes deal with rival,2024-08-20
"Elon Musks Twitter deal may be the worst leveraged buyout deal for banks since Lehman, raising risks to Tesla",2024-08-20
Tesla Dodged a Bullet on EU Tariffs. Why the Stock Is Wobbling.,2024-08-20
"Nvidia helped the stock market storm back, but this summers broadening theme never went away",2024-08-20
Europe just slashed tariffs on cars made by Tesla in China,2024-08-20
"Midday movers: Lilly, Palo Alto and Fabrinet rise; Lowe's, Boeing fall",2024-08-20
"Tesla Stock Falls on EUs Tariff News, Trumps Musk and Tax Credit Comments",2024-08-20
Brussels bows to Musk by slashing tariffs on China-made Teslas,2024-08-20
Elon Musk says hell take a job in the Trump cabinet if offered,2024-08-20
The EU just slashed its planned tariffs on several Chinese-made Tesla EVs,2024-08-20
"Trump praises Musk, but warns he could ditch EV tax credit",2024-08-20
"Tesla Stock Rises on EUs Tariff News, Trumps Musk and Tax Credit Comments",2024-08-20
EU Cuts Tariffs on China-Made EV Imports From Tesla,2024-08-20
"EU officials to cut tariffs on Tesla, Chinese EV makers",2024-08-20
Elon Musk is 'willing to serve' in Donald Trump's cabinet,2024-08-20
"Here is What to Know Beyond Why Tesla, Inc. (TSLA) is a Trending Stock",2024-08-20
Analyst updates Tesla stock forecast before October's key event,2024-08-20
Tesla Stock Rises After EU Cuts Tariff on Chinese-Made EVs to 9%. Its Not All Good News.,2024-08-20
5 Things to Know Before the Stock Market Opens,2024-08-20
Tesla Gets Lower Tariff Rate as EU Eases Penalties on Chinese-Made EVs,2024-08-20
You Won't Believe What Uber's CEO Just Said About Tesla,2024-08-20
Tesla Gets Lower EU Tariff Rate on Chinese-Made EV Imports,2024-08-20
Tesla to get lower EU tariff on its Chinese-made EVs,2024-08-20
Tesla reaps benefits as EU cuts planned tariffs on Chinese-made electric vehicles,2024-08-20
ANALYSIS  Tesla future models,2024-08-20
China robotaxi market could pass $60 bln in 2030- Jefferies,2024-08-19
"Why Tesla isn't a buy, but Nike is: Market Domination",2024-08-19
Copper miner vs. Tesla: ESG portfolio manager's stock picks,2024-08-19
GM And Tesla Keep Eating Ferrari's Dust,2024-08-19
"Final Trades: Tesla, EQT Corp and American Express",2024-08-19
Tesla is hiring workers for $48 an hour to wear motion-capture suits to train its humanoid robots,2024-08-19
"Musk blames the Fed for soft Tesla sales, but rate cuts wont solve his problem, says ex-Hertz CEO",2024-08-19
Looking at Elon Musk through the Overton window,2024-08-19
Tesla Stock Gains at the Start of a Busy Week for the EV Sector,2024-08-19
"No, Elon Musk did not give a Putin-backed warlord a Tesla Cybertruck",2024-08-19
Tesla will pay you to pretend to be a robot,2024-08-19
A lot of new Tesla Model 3s are just sitting in a field in Florida,2024-08-19
Tesla Stock Is Higher at the Start of a Busy News Week for the EV Sector,2024-08-19
"Ford-Tesla partnership, Nvidia's path to growth: Opening Bid",2024-08-19
Tesla Trails Rivals in Offering Driver-Assistance Features in China,2024-08-19
"Elon Musk Is The Richest Person In The World  How Much Does He Pay Employees At Tesla, SpaceX And X?",2024-08-19
12 takeaways from 2 Tesla events: Piper Sandler,2024-08-19
"2 AI Stocks to Buy Before They Soar 164% and 366%, According to Select Wall Street Analysts",2024-08-19
Tesla Stock Falls. EV Rival XPeng Posts Earnings on Tuesday.,2024-08-19
Tesla is testing whether stockholders have the power to overrule a judge,2024-08-18
This Chinese EV Maker Just Unveiled Ultrafast Charging. Thats Good for Tesla.,2024-08-18
Tesla Rebounds After Big Round-Trip; BYD Is Only EV Stock To Do This,2024-08-18
Is Lucid Group a Millionaire Maker?,2024-08-18
Why Is Samsara Inc. (IOT) the Best Cheap Robotics Stock to Buy Now?,2024-08-17
"Are Hedge Funds Bullish on ServiceNow, Inc. (NOW) Right Now?",2024-08-17
"Autodesk, Inc. (ADSK): You Should Pay Attention To This Cheap Robotic Stock Now",2024-08-17
Zebra Technologies Corporation (ZBRA): Wall Street Analysts Are Bullish On This Cheap Robotic Stock Now,2024-08-17
"Teradyne, Inc. (TER): Is It The Best Cheap Robotics Stock to Buy According to Analysts?",2024-08-17
PTC Inc. (PTC): Should You Invest In This Cheap Robotic Stock Right Now?,2024-08-17
Nordson Corporation (NDSN): This Cheap Robotics Stock Is Recommended By Street Analysts Right Now,2024-08-17
Microchip Technology Incorporated (MCHP): Why Are Hedge Funds Bullish On This Cheap Robotics Stock Right Now?,2024-08-17
"Illumina, Inc. (ILMN): Is This Cheap Robotic Stock a Good Buy Right Now?",2024-08-17
Tesla Is Great. Here's Why You Shouldn't Buy It,2024-08-17
IPG Photonics Corporation (IPGP): A Good and Cheap Robotic Stock To Buy?,2024-08-17
Chechen warlord invites Musk to Russia after he's filmed driving machine-gun mounted Cybertruck,2024-08-17
"Breaking up Google, Elon Musk's AI startup, Boeing's Starliner stuck in space: Tech news roundup",2024-08-17
Sigma Lithium Corporation (NASDAQ:SGML) Q2 2024 Earnings Call Transcript,2024-08-17
10 Cheap Robotics Stocks To Buy,2024-08-16
Theres No Shame in Holding Cash,2024-08-16
Generative AI is changing the game for business. Here's how.,2024-08-16
Is Rivian Stock A Buy Or A Sell As The EV Startup Targets Profit Per Vehicle By Q4?,2024-08-16
Defense tech startup Anduril aims to take a Tesla-like approach to weapons manufacturing,2024-08-16
Elon Musk's X has a major advertising problem,2024-08-16
"Magnificent Seven Stocks: Nvidia Stock, Tesla Rally",2024-08-16
Tesla Stock Is Up. Where the Charts Say It Goes Next.,2024-08-16
Tesla Stock Is Down. Where the Charts Say It Goes Next.,2024-08-16
Cybertruck Buyers Get Unusual Surprise: A Brand-New Truck Delivered With Dirt and Mud,2024-08-16
Hazeltree report shows SMCI ahead of Tesla as most shorted security in July,2024-08-16
Is Tesla Stock A Buy Or A Sell As It Looks To Advance Above Key Resistance Levels?,2024-08-16
"Even Though It's the Only Vanguard Sector ETF That Is Down in 2024, I Have High Hopes for This Fund Over the Next 5 Years",2024-08-16
Tesla Stock Is Rising. Heres Where It Can Go Next.,2024-08-16
"Tesla has lost share in all geographies, in both xEVs and EVs: Bernstein",2024-08-16
"China Utility to Expand EV Supercharging in Beijing, CCTV Says",2024-08-15
Is Tesla Inc (NASDAQ:TSLA) the Best Cathie Wood Stock to Buy?,2024-08-15
"Why Tesla Stock Should Be Traded With Your Mind, Not Your Heart",2024-08-15
Tesla Stock Took Off. Heres What Sent It Higher.,2024-08-15
Will Tesla's 'Grease Meets The Jetsons' Diner Kick Off A New Trend?,2024-08-15
What's Going On With Tesla Stock Today,2024-08-15
Tesla Stock Is Rising. Heres Whats Moving It.,2024-08-15
Global stocks surge as US expected to avoid recession,2024-08-15
"Why Tesla, Lucid, and Toyota Motors Stocks Raced Higher Today",2024-08-15
Elon Musks financial woes at X have Tesla bulls fearing he will liquidate more stock,2024-08-15
"3 Artificial Intelligence (AI) Stocks That Can Skyrocket Up to 1,200%, According to Select Wall Street Pundits",2024-08-15
Ron Baron's Strategic Moves in Q2 2024: A Closer Look at Tesla's Position Adjustment,2024-08-14
Elon Musk and J.K. Rowling are named in Olympian's cyberbullying lawsuit,2024-08-14
"S&P 500 Gains and Losses Today: Progressive, Schwab Boosted by Strong Monthly Updates",2024-08-14
Tesla Stock Dropped. Why the Latest Inflation News Didnt Help.,2024-08-14
Elon Musk's AI bot Grok is spitting out deepfakes of Barack Obama and Taylor Swift,2024-08-14
"Musk-Trump Interview Covers Key Areas For Investors, But Mum On These",2024-08-14
Tesla Stock Is Down. Why the Latest Inflation News Isnt Helping.,2024-08-14
US safety agency ends probe of Tesla suspension failures without seeking a recall,2024-08-14
Tesla (TSLA) Stock Tops 200-Day SMA: Should You Buy Now?,2024-08-14
Is Tesla Inc (NASDAQ:TSLA) the Best Stock to Buy on the Dip?,2024-08-14
Chinese carmaker overtakes Tesla to develop worlds fastest-charging electric battery,2024-08-14
Analyst revisits Tesla stock price target with eye on key value driver,2024-08-14
"Tesla's FSD v12 technology 'is stunningly good, but not useful today': analyst",2024-08-14
Tesla Stock Is Down. Its Bracing for This.,2024-08-14
Mag 7 Insiders Arent Buying Stock Dips,2024-08-14
"Starbucks CEO Faces a Cooling Economy, Value Shoppers. Why the Task Ahead Is Tough, And 5 Other Things to Know Today.",2024-08-14
Worlds 15 Most Famous Traders of All Time,2024-08-14
"Be Careful, TSLA Stock Investors! TSLA Is Running on Empty.",2024-08-14
US-based QPO launches energy storage plant with Taiwan-based Yulon backing,2024-08-13
UAW files federal labor charges against Donald Trump and Elon Musk after threatening workers on X interview,2024-08-13
"Judge who had $15,000+ in Tesla stock steps down from judging Musk's Texas lawsuits",2024-08-13
"Tesla, Lucid, and Quantumscape Shares Jumped Today",2024-08-13
Tesla's Elon Musk advises against vilifying oil and industry,2024-08-13
"UAW Files Labor Charges Against Musk, Trump After Interview. Tesla Stock Is Still Up.",2024-08-13
Auto workers union seeks NLRB investigation of Trump and Musk comments about firing striking workers,2024-08-13
Texas judge in lawsuit by Musk's X against advertisers exits case,2024-08-13
UAW Files Federal Labor Charges Against Trump and Musk for Threatening Workers,2024-08-13
"Top Stock Movers Now: Starbucks, Chipotle, Tesla, and More",2024-08-13
"With volatility ahead, invest in the Mag 7: Portfolio manager",2024-08-13
"DJT Stock Falls After Trump, Musk Talk on X. What It Means for Truth Social.",2024-08-13
"UAW files complaints against Trump, Musk for trying to intimidate workers",2024-08-13
Tesla Stock Is Up After Musks Trump Interview,2024-08-13
Union calls Donald Trump and Elon Musk 'scabs' then hits them with federal labor charges,2024-08-13
"UAW files charges against Trump, Musk for trying to intimidate workers",2024-08-13
WSJ's Tim Higgins on the key takeaways from Elon Musk's interview with Trump,2024-08-13
Does Tesla (TSLA) Have Attractive Growth Opportunities Ahead?,2024-08-13
"DJT Stock Slips After Trump, Musk Talk on X. What It Means for Truth Social.",2024-08-13
"Here's the ""Magnificent Seven"" Stock I'm Loading Up On During the Current Market Sell-Off",2024-08-13
Is Tesla Stock a Buy?,2024-08-13
"Trump Musk Interview Rambles Through Inflation, Taxes, Trade, Education And Nuclear Power (Live Coverage)",2024-08-12
Indians wanting their money back for undelivered Teslas shows how drastically the EV market changed,2024-08-12
"Trump, Musks Interview on X  Delayed by Technical Problems",2024-08-12
Musk Says Cyberattack Disrupted Trump Interview (Live Coverage),2024-08-12
"Trump, Musks Interview on X Begins After Delays",2024-08-12
Cyberattack Derails Elon Musk's Trump Interview. (Live Coverage),2024-08-12
Elon Musk's Trump Interview Runs Into Technical Difficulties. (Live Coverage),2024-08-12
"Uber CEO snubs Elon Musks vision of a $30,000 payday for Tesla owners who rent out their cars as self-driving taxis",2024-08-12
Are Magnificent 7 valuations attractive again?,2024-08-12
"Column: With lawsuit against advertisers, Elon Musk plumbs new depths of asininity",2024-08-12
Donald Trump and Elon Musks Interview on X Today: What to Watch,2024-08-12
Tesla Isnt Taking Orders on Its Lower-Priced Cybertruck. What the Stock Is Doing.,2024-08-12
Elon Musk Is Interviewing Donald Trump 'With No Limits On Subject Matter.' Could Trump Lose Money On The Deal?,2024-08-12
Judge in Elon Musk's Texas lawsuits owns thousands of dollars worth of Tesla stock,2024-08-12
"Teslas Dojo, a timeline",2024-08-12
Donald Trump to Be Interviewed by Elon Musk on X Today. What About Truth Social?,2024-08-12
Tesla halts cheap Cybertruck orders as expensive versions pile up,2024-08-12
Tesla halts online sales of cheapest Cybertruck model,2024-08-12
Elon Musk's political views won't help Tesla,2024-08-12
Non-Mag 7 equities are a 'once in a generation opportunity',2024-08-12
"Magnificent Seven Stocks: Nvidia Stock Rallies; Tesla, Google Sell Off",2024-08-14
Tesla Stock Is Down. Why the Latest Inflation News Isnt Helping.,2024-08-14
US safety agency ends probe of Tesla suspension failures without seeking a recall,2024-08-14
Tesla (TSLA) Stock Tops 200-Day SMA: Should You Buy Now?,2024-08-14
Is Tesla Inc (NASDAQ:TSLA) the Best Stock to Buy on the Dip?,2024-08-14
Chinese carmaker overtakes Tesla to develop worlds fastest-charging electric battery,2024-08-14
Is Tesla Stock A Buy Or A Sell As It Faces Resistance After 20% Decline Since Earnings?,2024-08-14
Analyst revisits Tesla stock price target with eye on key value driver,2024-08-14
"Tesla's FSD v12 technology 'is stunningly good, but not useful today': analyst",2024-08-14
Tesla Stock Is Down. Its Bracing for This.,2024-08-14
Mag 7 Insiders Arent Buying Stock Dips,2024-08-14
"Starbucks CEO Faces a Cooling Economy, Value Shoppers. Why the Task Ahead Is Tough, And 5 Other Things to Know Today.",2024-08-14
Worlds 15 Most Famous Traders of All Time,2024-08-14
"Be Careful, TSLA Stock Investors! TSLA Is Running on Empty.",2024-08-14
US-based QPO launches energy storage plant with Taiwan-based Yulon backing,2024-08-13
UAW files federal labor charges against Donald Trump and Elon Musk after threatening workers on X interview,2024-08-13
"Judge who had $15,000+ in Tesla stock steps down from judging Musk's Texas lawsuits",2024-08-13
"Tesla, Lucid, and Quantumscape Shares Jumped Today",2024-08-13
Tesla's Elon Musk advises against vilifying oil and industry,2024-08-13
"UAW Files Labor Charges Against Musk, Trump After Interview. Tesla Stock Is Still Up.",2024-08-13
Auto workers union seeks NLRB investigation of Trump and Musk comments about firing striking workers,2024-08-13
Texas judge in lawsuit by Musk's X against advertisers exits case,2024-08-13
UAW Files Federal Labor Charges Against Trump and Musk for Threatening Workers,2024-08-13
"Top Stock Movers Now: Starbucks, Chipotle, Tesla, and More",2024-08-13
"With volatility ahead, invest in the Mag 7: Portfolio manager",2024-08-13
"DJT Stock Falls After Trump, Musk Talk on X. What It Means for Truth Social.",2024-08-13
"UAW files complaints against Trump, Musk for trying to intimidate workers",2024-08-13
Tesla Stock Is Up After Musks Trump Interview,2024-08-13
Union calls Donald Trump and Elon Musk 'scabs' then hits them with federal labor charges,2024-08-13
"UAW files charges against Trump, Musk for trying to intimidate workers",2024-08-13
WSJ's Tim Higgins on the key takeaways from Elon Musk's interview with Trump,2024-08-13
Does Tesla (TSLA) Have Attractive Growth Opportunities Ahead?,2024-08-13
"DJT Stock Slips After Trump, Musk Talk on X. What It Means for Truth Social.",2024-08-13
"Here's the ""Magnificent Seven"" Stock I'm Loading Up On During the Current Market Sell-Off",2024-08-13
Is Tesla Stock a Buy?,2024-08-13
"Trump Musk Interview Rambles Through Inflation, Taxes, Trade, Education And Nuclear Power (Live Coverage)",2024-08-12
Indians wanting their money back for undelivered Teslas shows how drastically the EV market changed,2024-08-12
"Trump, Musks Interview on X  Delayed by Technical Problems",2024-08-12
Musk Says Cyberattack Disrupted Trump Interview (Live Coverage),2024-08-12
"Trump, Musks Interview on X Begins After Delays",2024-08-12
Cyberattack Derails Elon Musk's Trump Interview. (Live Coverage),2024-08-12
Elon Musk's Trump Interview Runs Into Technical Difficulties. (Live Coverage),2024-08-12
"Uber CEO snubs Elon Musks vision of a $30,000 payday for Tesla owners who rent out their cars as self-driving taxis",2024-08-12
Are Magnificent 7 valuations attractive again?,2024-08-12
"Column: With lawsuit against advertisers, Elon Musk plumbs new depths of asininity",2024-08-12
Donald Trump and Elon Musks Interview on X Today: What to Watch,2024-08-12
Tesla Isnt Taking Orders on Its Lower-Priced Cybertruck. What the Stock Is Doing.,2024-08-12
Elon Musk Is Interviewing Donald Trump 'With No Limits On Subject Matter.' Could Trump Lose Money On The Deal?,2024-08-12
Judge in Elon Musk's Texas lawsuits owns thousands of dollars worth of Tesla stock,2024-08-12
"Teslas Dojo, a timeline",2024-08-12
Donald Trump to Be Interviewed by Elon Musk on X Today. What About Truth Social?,2024-08-12
Tesla halts cheap Cybertruck orders as expensive versions pile up,2024-08-12
Tesla halts online sales of cheapest Cybertruck model,2024-08-12
Elon Musk's political views won't help Tesla,2024-08-12
Non-Mag 7 equities are a 'once in a generation opportunity',2024-08-12
Magnificent Seven Stocks: Nvidia Stock Rallies; Tesla Slides,2024-08-12
Elon Musk Is Interviewing Donald Trump 'With No Limits On Subject Matter.' Could Trump Lose Money On The Deal?,2024-08-12
Is Tesla Stock A Buy Or A Sell As It Faces Resistance After 20% Decline Since Earnings?,2024-08-12
Marathon To Raise $250 Million To Buy More Bitcoin,2024-08-12
Elon Musk's X was hit with 9 complaints after scraping user data to train AI,2024-08-12
Donald Trump to Be Interviewed by Elon Musk on X Today. What About Trump Media?,2024-08-12
Tesla Not Taking Orders on Lower-Priced Cybertruck. What the Stock Is Doing.,2024-08-12
"Fed and Markets Are on Different Pages, Why a September Cut Isnt Certain. And 5 Other Things to Know Today.",2024-08-12
Musk Will Interview Trump on X. Why DJT Stock Is Slipping.,2024-08-12
"Tesla, Inc. (TSLA): Should You Add This Self Driving Car Stock to Your Portfolio Now?",2024-08-12
"Powered by Nvidia and AI, humanoid ambitions take shape",2024-08-12
"Why Nvidia, Tesla are betting on AI-powered humanoid robots",2024-08-12
Musk embraces Trump and scorns subsidies. But Tesla still lobbies for US benefits,2024-08-12
"Why Is Morgan Stanley Bullish on Tesla, Inc. (TSLA) Right Now?",2024-08-11
"Is Now the Time to Buy the 2 Worst-Performing Stocks in the ""Magnificent Seven""?",2024-08-11
Elon Musk Just Said Tesla Has a $200 Trillion Opportunity in Front of It. Here's What It Would Take to Get There.,2024-08-11
"The lowest-priced Cybertruck is now $100,000",2024-08-11
10 Best Self Driving Car Stocks To Buy Now,2024-08-11
QUALCOMM Incorporated (QCOM): Among Morgan Stanley's Top Humanoid Robot Stock Picks,2024-08-11
Arm Holdings plc (ARM): Why is Morgan Stanley Bullish on This Humanoid Robot Stock Now?,2024-08-11
"Cadence Design Systems, Inc. (CDNS): One of Morgan Stanley's Humanoid Robot Stock Picks Now?",2024-08-11
Why Is Morgan Stanley Bullish on Infineon Technologies AG (IFNNY) Right Now?,2024-08-11
STMicroelectronics N.V. (STM): Morgan Stanley is Bullish on This Humanoid Robot Stock Now,2024-08-11
"Synopsys, Inc. (SNPS): The Best Humanoid Robot Stock to Buy Now?",2024-08-11
CNBC Speculates Reasons Why Elon Musk And Donald Trump Are 'Teaming Up To Win The White House'  Is The EV Revolution Worth It?,2024-08-11
Uber CEO Is Skeptical About Elon Musks Robotaxi Idea,2024-08-11
"Tesla halts orders for $61,000 Cybertruck, cheapest version now $100,000",2024-08-11
Recession? Really? Come on...: Morning Brief,2024-08-11
The 'G' in ESG is gaining more shareholder love than the 'E' or 'S',2024-08-11
How Elon Musk Is Using Tesla and His Other Companies to Kickstart xAI,2024-08-11
How Elon Musk Is Using His Empire to Kickstart xAI,2024-08-11
"Down Between 29% and 82% From Their 52-Week Highs, Should You Buy the Dip on Tesla, Cognex, Or Plug Power Stock?",2024-08-11
"Is Tesla, Inc. (TSLA) a Good Consumer Discretionary Stock To Invest In?",2024-08-10
2 Unstoppable Growth Stocks That Could Crush the S&P 500 Over the Next 5 Years,2024-08-10
This Could Make or Break Tesla Stock This Year,2024-08-10
"Teslas Dojo, a timeline",2024-08-10
Tesla Round-Trips Huge Run; BYD Tumbles Amid New Models,2024-08-10
Nvidia chips turbocharge humanoid learning,2024-08-10
Nikola Corporation (NASDAQ:NKLA) Q2 2024 Earnings Call Transcript,2024-08-10
How Tesla's NACS charger became the champion of the charger world,2024-08-10
Foreign Spy Cars? The U.S. Government Isn't Playing Around With Robotaxis.,2024-08-10
"Tesla stops taking orders for cheapest Cybertruck, offers $100,000 version now",2024-08-09
Tesla Stock Wobbled. Solid China Sales Didnt Give Much of a Boost.,2024-08-09
"I Tested Teslas New Full Self-Driving Software. What I Thought After More Than 1,000 Miles.",2024-08-09
"Electric Car Wars: Who Will Win The Battle For The $30,000 EV?",2024-08-08
"Magnificent Seven Stocks: Nvidia Stock, Tesla Rally; Meta Retakes Key Level",2024-08-08
Tough Summer for US Stocks Overshadows Estimate-Beating Earnings,2024-08-08
Tesla Stock Is Up. Heres Where Its Headed.,2024-08-08
Tesla Stock Is Slipping. Heres the Reason Its Moving.,2024-08-08
Sunrun partners with Tesla for virtual power plant in Texas,2024-08-08
20 Most Comfortable Cars of 2024,2024-08-07
"Tesla: FSD price cuts could be critical catalyst for shares, RBC says",2024-08-07
Tesla Stock (NASDAQ:TSLA): Heres Its Secret Growth Machine,2024-08-07
"Abandoned Acquisitions, AI, and Robotaxis...Big Things in the World of Stocks",2024-08-07
Tesla's energy business expands with Sunrun partnership in Texas,2024-08-07
Tesla CEO Elon Musk Deserves His $60 Billion Pay Package. This Analysis Backs It Up.,2024-08-07
US auto safety agency seeks information from Tesla on fatal Cybertruck crash and fire in Texas,2024-08-07
Big Tech is in 'penalty box' for now: Barclays strategist,2024-08-07
Tesla Stock Is Falling. Ubers Self-Driving News Didnt Help.,2024-08-07
Tesla Stock Ended Higher. It Was All About Japan.,2024-08-07
Sunrun Stock Surges After Surprise Profit. The Solar Panel Installer Teams Up With Tesla.,2024-08-07
Why this Tesla investor and Elon Musk supporter is buying the stock dip,2024-08-07
A black swan market crash on the horizon?,2024-08-07
Tesla Stock Is Rising. Heres How Other EV Makers Are Helping.,2024-08-07
Elon Musks backing of Donald Trump is hurting Teslas struggling EV business in Europe,2024-08-07
"This ""Magnificent Seven"" Stock Has Tanked 7% in 2024: Is It Time to Buy the Dip?",2024-08-07
Jim Cramer Says You Can Buy Tesla Inc (NASDAQ:TSLA) Right Here,2024-08-07
"Americans just cant quit their giant, gas-burning trucks",2024-08-07
Tesla Deploys Fix to 1.6 Million Cars in China for Hood Lock,2024-08-07
Tesla Recalling 1.68 Million Cars in China Over Hood Problem,2024-08-07
Tesla is recalling more than 1.6 million cars in China for a remote software fix,2024-08-06
EV Fund Outflows Hit $1.6 Billion as Trump Fears Add to Slowdown,2024-08-06
Sunrun and Tesla Partner to Support Texas Power Grid Using Residential Solar-Plus-Battery Systems,2024-08-06
"Every Time We Drive We Wonder If Is It Going To Break Again,' Says A Cybertruck Owner Prompting Elon Musk To Step In Personally",2024-08-06
Tesla Stock Is Rising. Its All About Japan.,2024-08-06
"A fiery, deadly Tesla Cybertruck crash has caught the Fed's attention",2024-08-06
German drugstore chain shuns Teslas over Musk's support for Trump,2024-08-06
"Stock market turmoil only half complete, warns Wall Street giant",2024-08-06
Elon Musk's X thinks boycotting advertisers are creating a monopoly against it,2024-08-06
"Tesla OTA recall for China, too",2024-08-06
Chinese carmaker beats Tesla in race to put humanoid robots in factories,2024-08-06
Cathie Wood Goes Bargain Hunting: 3 Stocks She Just Bought,2024-08-06
Uber Stock Jumps as Q2 Profits More Than Double,2024-08-06
3 Things You Need to Know if You Buy Tesla Today,2024-08-06
